176,Jain 2019,Autoethnography of a hard of hearing traveler,Consensus,10.1145/3308561.3353800,Autoethnography of a hard of hearing traveler,Dhruv Jain,2019,13,,Not Applicable ,Not Applicable,Not Applicable,Not Applicable ,Not Applicable,Not Applicable,Not Applicable,Not Applicable,"Sensory (i.e., kaleidoscope)",,Field study,Not applicable,Not Applicable,Autoethnography,Not Applicable,Mobile,"Public space (i.e., Bowling alley)",Deaf or hard of hearing (DHH),People with disabilities,Participatory design with stakeholders with disabilities; User evaluation with stakeholders with disabilities,No,Other,Increasing independence; Increasing understanding of users; Supporting communication,Empirical,,1,N/A,N/A,N/A,N/A,N/A,,1,N/A,N/A,N/A,N/A,N/A,N/A,N/A,N/A,N/A,N/A,N/A,N/A,N/A,N/A,N/A,N/A,N/A,N/A,N/A,N/A,N/A,N/A,N/A,N/A,N/A,N/A,N/A,N/A,N/A,N/A,N/A,N/A,N/A,N/A,N/A,,N/A,N/A,N/A,N/A,N/A,N/A,N/A,N/A,N/A,N/A,N/A,N/A,N/A,N/A,N/A,N/A,N/A,N/A,N/A,N/A,N/A,N/A,N/A,N/A,N/A,N/A,N/A,N/A,N/A,N/A,N/A,N/A,N/A,N/A,N/A,N/A,,N/A,N/A,N/A,N/A,N/A,N/A,N/A,N/A,N/A,N/A,N/A,N/A,N/A,N/A,N/A,N/A,N/A,N/A,N/A,N/A,N/A,N/A,N/A,N/A,N/A,N/A,N/A,N/A,N/A,N/A,N/A,N/A,N/A,N/A,N/A,N/A,N/A,N/A,N/A,N/A,N/A,N/A,N/A,N/A,N/A,N/A,N/A,N/A,1,N/A,N/A,N/A,N/A,N/A,N/A,N/A,N/A,N/A,N/A,N/A,USA,
172,Payne 2019,Non-visual beats: Redesigning the groove pizza,Consensus,10.1145/3308561.3354590,Non-visual beats: Redesigning the groove pizza,William Payne,2019,4,,"Totally fun first (i.e., Entertainment game reappropriated)","Unstructured play (i.e., no rules, making art)","Entirely skill-based (i.e., trivia, sports)","Entirely Solo (i.e., Solitaire)","Most actions can be taken at any time, but there are some phases (i.e., PvP death reset timer)","Entirely Synchronous (i.e., RTS game)","Entirely Competitive (i.e., Spit card game)","Entirely Symetrical (i.e., Tik tac toe)","Construction (i.e., Music, painting, building)",N/A,No data collected,Not applicable,Not Applicable,Not Applicable,Not Applicable,PC,Not applicable,Blind or low vision (BLV),No user involvement,No representative user involvement,No user involvement,No user involvement,Increasing digital access; Increasing opportunities for enrichment ,Artifact,,0,0,0,0,0,0,,0,0,0,0,0,0,0,0,0,0,0,0,0,0,0,0,0,0,0,0,0,0,0,0,0,0,0,0,0,0,0,0,0,0,0,0,,0,0,0,0,0,0,0,0,0,0,0,0,0,0,0,0,0,0,0,0,0,0,0,0,0,0,0,0,0,0,0,0,0,0,0,0,,0,0,0,0,0,0,0,0,0,0,0,0,0,0,0,0,0,0,0,0,0,0,0,0,0,0,0,0,"0
",0,0,0,0,0,0,0,0,0,0,0,0,0,0,0,0,0,0,0,0,0,0,0,0,0,0,0,0,0,0,0,USA,N/A
171,Hair 2019,Evaluating automatic speech recognition for child speech therapy applications,Consensus,10.1145/3308561.3354606,Evaluating automatic speech recognition for child speech therapy applications,Adam Hair,2019,3,N/A,"Totally utility first (i.e., made by clinicians, fun incorporated later)","Game with rigid rules (i.e., video game)","Entirely skill-based (i.e., trivia, sports)","Entirely Solo (i.e., Solitaire)","Entirely Simultaneous (i.e., race)","Entirely Synchronous (i.e., RTS game)","Entirely Competitive (i.e., Spit card game)","Entirely Symetrical (i.e., Tik tac toe)",Challenge (Testing physical or mental abilities against others or self),NPRP,Controlled experiment; Telemetry / Big data / CSCW,Not applicable,Not Applicable,Not Applicable,Not Applicable,Tablet; PC,Research lab,Communication / Speech,People with disabilities,User evaluation with stakeholders with disabilities,No,Undisclosed,Supporting communication,Empirical,,7,0,0,0,0,0,,6,0,0,0,0,0,1,0,0,0,0,0,N/A,0,0,0,0,0,N/A,0,0,0,0,0,N/A,0,0,0,0,0,N/A,0,0,0,0,0,,N/A ,0,0,0,0,0,N/A,0,0,0,0,0,N/A,0,0,0,0,0,N/A,0,0,0,0,0,N/A,0,0,0,0,0,N/A ,0,0,0,0,0,,0,0,0,0,0,0,0,0,0,0,0,0,7,0,0,0,0,0,0,0,0,0,0,0,0,0,0,0,0,0,0,0,0,0,0,0,0,0,0,0,0,0,0,0,0,0,0,0,0,0,0,0,0,0,0,0,0,0,0,0,Australia,"USA, Wales, Qatar"
169,Alsaleem 2019,Leveraging shared control to empower people with tetraplegia to participate in extreme sports,Consensus,http://dx.doi.org/10.1145/ 10.1145/3308561.3353775,Leveraging Shared Control to Empower People with Tetraplegia to Participate in Extreme Sports,Ahmad Alsaleem,2019,12,,"Totally fun first (i.e., Entertainment game reappropriated)","Unstructured play (i.e., no rules, making art)","Entirely skill-based (i.e., trivia, sports)","Mix of solo and social affordances (i.e., Animal Crossing)","Entirely Simultaneous (i.e., race)","Entirely Synchronous (i.e., RTS game)","Mix of competitive and collaborative (i.e., Mario party 2 vs 2 mini games)","Entirely Asymetrical (i.e., Keep talking nobody explodes)","Sensory (i.e., kaleidoscope); Challenge (Testing physical or mental abilities against others or self)",N/A,Interview; Workshop or design session; Field study; Usability testing; Controlled experiment,Semi-structured interview,Ideation,Ethnography,Exert analysis,Tangible Interface,"Public space (i.e., Bowling alley)",Motor of physical impairment,"People with disabilities; Specialists (e.g., therapists, teachers)",Participatory design with stakeholders without disabilities; User evaluation with stakeholders without disabilities; User evaluation with stakeholders with disabilities,No,"Convienience sampling (i.e., Day program)",Increasing independence; Increasing physical access; Increasing understanding of users,Empirical; Artifact,,8,"3
",0,0,0,0,,5,N/A,N/A,N/A,N/A,N/A,3,N/A,N/A,N/A,N/A,N/A,N/A,N/A,N/A,N/A,N/A,N/A,N/A,N/A,N/A,N/A,N/A,N/A,N/A,N/A,N/A,N/A,N/A,N/A,N/A,N/A,N/A,N/A,N/A,N/A,,N/A,N/A,N/A,N/A,N/A,N/A,N/A,N/A,N/A,N/A,N/A,N/A,N/A,N/A,N/A,N/A,N/A,N/A,N/A,N/A,N/A,N/A,N/A,N/A,N/A,N/A,N/A,N/A,N/A,N/A,N/A,N/A,N/A,N/A,N/A,N/A,,N/A,N/A,N/A,N/A,N/A,N/A,N/A,N/A,N/A,N/A,N/A,N/A,N/A,N/A,N/A,N/A,N/A,N/A,N/A,N/A,N/A,N/A,N/A,N/A,1,N/A,N/A,N/A,N/A,N/A,2,N/A,N/A,N/A,N/A,N/A,4,N/A,N/A,N/A,N/A,N/A,1,N/A,N/A,N/A,N/A,N/A,N/A,"3
","N/A
",N/A,N/A,N/A,N/A,N/A,"N/A
",N/A,N/A,N/A,USA,N/A
167,Ringland 2019,DanceCraft: A whole-body interactive system for children with autism,Consensus,10.1145/3308561.3354604,DanceCraft: A whole-body interactive system for children with autism,Kathryn E. Ringland,2019,3,,"Mostly fun first (i.e., Design workshop with disabled stakeholders)","Flexible game (i.e., board game with house rules)","Entirely skill-based (i.e., trivia, sports)","Mix of solo and social affordances (i.e., Animal Crossing)","Most actions can be taken at any time, but there are some phases (i.e., PvP death reset timer)","Equal mix of synchronous and asynchronous affordances (i.e., World of Warcraft)","Mix of competitive and collaborative (i.e., Mario party 2 vs 2 mini games)","Both Symetrical and Asymetrical (i.e., Pandemic—similar turn structure with different character abilities)",Challenge (Testing physical or mental abilities against others or self),"National Institute of Mental Health, ARCS Foundation",Interview; Field study; Telemetry / Big data / CSCW,Semi-structured interview,Not Applicable,Cultural,Not Applicable,PC,"Home; Disability community space (i.e., Day program)",Autism,"People with disabilities; Specialists (e.g., therapists, teachers)",User evaluation with stakeholders without disabilities; User evaluation with stakeholders with disabilities,No,Undisclosed,Personal informatics and changing behavior,Artifact,,12,N/A,N/A,N/A,N/A,N/A,,7,N/A,N/A,N/A,N/A,N/A,5,N/A,N/A,N/A,N/A,N/A,N/A,N/A,N/A,N/A,N/A,N/A,N/A,N/A,N/A,N/A,N/A,N/A,N/A,N/A,N/A,N/A,N/A,N/A,N/A,N/A,N/A,N/A,N/A,N/A,,N/A,N/A,N/A,N/A,N/A,N/A,N/A,N/A,N/A,N/A,N/A,N/A,N/A,N/A,N/A,N/A,N/A,N/A,N/A,N/A,N/A,N/A,N/A,N/A,N/A,N/A,N/A,N/A,N/A,N/A,N/A,N/A,N/A,N/A,N/A,N/A,,N/A,N/A,N/A,N/A,N/A,N/A,N/A,N/A,N/A,N/A,N/A,N/A,12,N/A,N/A,N/A,N/A,N/A,N/A,N/A,N/A,N/A,N/A,N/A,N/A,N/A,N/A,N/A,N/A,N/A,N/A,N/A,N/A,N/A,N/A,N/A,N/A,N/A,N/A,N/A,N/A,N/A,N/A,N/A,N/A,N/A,N/A,N/A,N/A,N/A,N/A,N/A,N/A,N/A,N/A,N/A,N/A,N/A,N/A,N/A,USA,
166,India 2019,Computational thinking as play: Experiences of children who are blind or low vision in india,Consensus,10.1145/3308561.3354608,Computational thinking as play: Experiences of children who are blind or low vision in india,Gesu India,2019,4,N/A,"Mostly fun first (i.e., Design workshop with disabled stakeholders)","Semi-structured play (i.e., playground game)","Entirely skill-based (i.e., trivia, sports)","Entirely social (i.e., Tag)","Entirely Simultaneous (i.e., race)","Entirely Synchronous (i.e., RTS game)","Mostly Collaborative (i.e., Animal Crossing)","Entirely Symetrical (i.e., Tik tac toe)","Sensory (i.e., kaleidoscope); Construction (i.e., Music, painting, building); Challenge (Testing physical or mental abilities against others or self)",N/A,Field study,Not applicable,Not Applicable,Ethnography,Not Applicable,Tangible Interface; PC,School,Blind or low vision (BLV),People with disabilities,User evaluation with stakeholders with disabilities,No,Undisclosed,Increasing understanding of users; Education; Increasing opportunities for enrichment ,Artifact,,12,0,0,0,0,0,,8,0,0,0,0,0,4,0,0,0,0,0,0,0,0,0,0,0,0,0,0,0,0,0,0,0,0,0,0,0,0,0,0,0,0,0,,N/A,0,0,0,0,0,N/A,0,0,0,0,0,N/A,0,0,0,0,0,N/A,0,0,0,0,0,N/A,0,0,0,0,0,N/A,0,0,0,0,0,,0,0,0,0,0,0,0,0,0,0,0,0,12,0,0,0,0,0,0,0,0,0,0,0,0,0,0,0,0,0,0,0,0,0,0,0,0,0,0,0,0,0,0,0,0,0,0,0,0,0,0,0,0,0,12,0,0,0,0,0,India,UK
165,Lobo 2019,CHIMELIGHT: Augmenting instruments in interactive music therapy for children with neurodevelopmental disorders,Consensus,10.1145/3308561.3353784,CHIMELIGHT: Augmenting instruments in interactive music therapy for children with neurodevelopmental disorders,Joana Lobo,2019,12,,"Mostly fun first (i.e., Design workshop with disabled stakeholders)","Semi-structured play (i.e., playground game)","Entirely skill-based (i.e., trivia, sports)","Mostly Solo, but can play against AI (i.e., Single player StarCraft)","Most actions can be taken at any time, but there are some phases (i.e., PvP death reset timer)","Entirely Synchronous (i.e., RTS game)","Entirely Collaborative (i.e., Pandemic)","Mostly Symmetrical (i.e., Uno)","Construction (i.e., Music, painting, building)",,Interview; Workshop or design session; Field study; Case study,Semi-structured interview,Design probe,Ethnography,Not Applicable,Mobile; IoT,Clinic,Autism; Intellectual or developmental disability (IDD),"People with disabilities; Specialists (e.g., therapists, teachers)",User evaluation with stakeholders without disabilities; User evaluation with stakeholders with disabilities,No,"Convienience sampling (i.e., Day program)",Personal informatics and changing behavior; Education; Increasing opportunities for enrichment ,Empirical; Artifact,,3,4,N/A,N/A,N/A,N/A,,2,N/A,N/A,N/A,N/A,N/A,1,N/A,N/A,N/A,N/A,N/A,N/A,N/A,N/A,N/A,N/A,N/A,N/A,N/A,N/A,N/A,N/A,N/A,N/A,N/A,N/A,N/A,N/A,N/A,N/A,N/A,N/A,N/A,N/A,N/A,,N/A,N/A,N/A,N/A,N/A,N/A,N/A,N/A,N/A,N/A,N/A,N/A,N/A,N/A,N/A,N/A,N/A,N/A,N/A,N/A,N/A,N/A,N/A,N/A,N/A,N/A,N/A,N/A,N/A,N/A,N/A,N/A,N/A,N/A,N/A,N/A,,N/A,N/A,N/A,N/A,N/A,N/A,N/A,N/A,N/A,N/A,N/A,N/A,3,N/A,N/A,N/A,N/A,N/A,N/A,N/A,N/A,N/A,N/A,N/A,N/A,N/A,N/A,N/A,N/A,N/A,N/A,N/A,N/A,N/A,N/A,N/A,N/A,N/A,N/A,N/A,N/A,N/A,N/A,N/A,N/A,N/A,N/A,N/A,N/A,N/A,N/A,N/A,N/A,N/A,N/A,N/A,N/A,N/A,N/A,N/A,JAPAN,
164,Menzies 2019,Unlocking accessible escape rooms,Consensus,10.1145/3308561.3354602,Unlocking Accessible Escape Rooms ,Rachel Menzies,2019,3,,"Totally fun first (i.e., Entertainment game reappropriated)","Flexible game (i.e., board game with house rules)","Entirely skill-based (i.e., trivia, sports)","Mostly social, but aspects are independent (i.e., House on Hill haunt transition)","Entirely Simultaneous (i.e., race)","Entirely Synchronous (i.e., RTS game)","Mix of competitive and collaborative (i.e., Mario party 2 vs 2 mini games)","Both Symetrical and Asymetrical (i.e., Pandemic—similar turn structure with different character abilities)",Challenge (Testing physical or mental abilities against others or self),N/A,Workshop or design session; Survey,Not applicable,Affinity diagram,Not Applicable,Not Applicable,No Technology,"Public space (i.e., Bowling alley)",General disability or accessibility,"People with disabilities; Specialists (e.g., therapists, teachers); People without disabilities",User evaluation with stakeholders without disabilities; User evaluation with stakeholders with disabilities,No,Social Media,Increasing understanding of users,Empirical,,48,21,0,0,0,0,,N/A,N/A,N/A,0,0,0,N/A,N/A,N/A,0,0,0,N/A,N/A,N/A,0,0,0,N/A,N/A,N/A,0,0,0,N/A,N/A,N/A,0,0,0,N/A,N/A,N/A,0,0,0,,N/A,N/A,N/A,0,0,0,N/A,N/A,N/A,0,0,0,N/A,N/A,N/A,0,0,0,N/A,N/A,N/A,0,0,0,N/A,N/A,N/A,0,0,0,N/A,N/A,N/A,0,0,0,,0,0,0,0,0,0,0,0,0,0,0,0,0,0,0,0,0,0,0,0,0,0,0,0,N/A,N/A,N/A,0,0,0,N/A,N/A,N/A,0,0,0,N/A,N/A,N/A,0,0,0,0,0,0,0,0,0,48,21,N/A,0,0,0,0,0,0,0,0,0,United Kingdom,"North America, Europe, South America, Australia, Asia"
163,Gadiraju 2019,BrailleBlocks: Braille toys for cross-ability collaboration,Consensus,10.1145/3308561.3356104,BrailleBlocks: Braille toys for cross-ability collaboration,Vinitha Gadiraju,2019,3,N/A,"Mostly utility first (i.e., primary utilitarian mechanic designed first)","Semi-structured play (i.e., playground game)","Mostly skill-based (i.e.,  Mario Cart)","Entirely social (i.e., Tag)","Most actions can be taken at any time, but there are some phases (i.e., PvP death reset timer)","Entirely Synchronous (i.e., RTS game)","Mix of competitive and collaborative (i.e., Mario party 2 vs 2 mini games)","Mostly Asymetrical (i.e., Tag)","Construction (i.e., Music, painting, building); Challenge (Testing physical or mental abilities against others or self)",,Interview; Case study,Structured interview,Not Applicable,Cultural,Not Applicable,Tangible Interface; PC,Unknown,Blind or low vision (BLV),People with disabilities; Caregivers,User evaluation with stakeholders with disabilities,No,Undisclosed,Increasing independence; Supporting communication; Education; Increasing opportunities for enrichment ,Artifact,,6,N/A,N/A,N/A,5,N/A,,N/A,N/A,N/A,N/A,N/A,N/A,N/A,N/A,N/A,N/A,N/A,N/A,N/A,N/A,N/A,N/A,N/A,N/A,N/A,N/A,N/A,N/A,N/A,N/A,N/A,N/A,N/A,N/A,N/A,N/A,N/A,N/A,N/A,N/A,N/A,N/A,,N/A,N/A,N/A,N/A,N/A,N/A,N/A,N/A,N/A,N/A,N/A,N/A,N/A,N/A,N/A,N/A,N/A,N/A,N/A,N/A,N/A,N/A,N/A,N/A,N/A,N/A,N/A,N/A,N/A,N/A,N/A,N/A,N/A,N/A,N/A,N/A,,N/A,N/A,N/A,N/A,N/A,N/A,N/A,N/A,N/A,N/A,N/A,N/A,N/A,N/A,N/A,N/A,N/A,N/A,N/A,N/A,N/A,N/A,N/A,N/A,N/A,N/A,N/A,N/A,N/A,N/A,N/A,N/A,N/A,N/A,N/A,N/A,N/A,N/A,N/A,N/A,N/A,N/A,N/A,N/A,N/A,N/A,N/A,N/A,N/A,N/A,N/A,N/A,N/A,N/A,6,N/A,N/A,N/A,N/A,N/A,USA,N/A
162,Hurd 2019,Insights for more usable VR for people with amblyopia,Consensus,10.1145/3308561.3356110,Insights for more usable VR for people with amblyopia,Ocean Hurd,2019,3,N/A,"Both fun and utility first (i.e., Design workshop with diverse stakeholders)","Game with rigid rules (i.e., video game)","Entirely skill-based (i.e., trivia, sports)","Entirely Solo (i.e., Solitaire)","Entirely Simultaneous (i.e., race)","Entirely Synchronous (i.e., RTS game)","Entirely Competitive (i.e., Spit card game)","Entirely Symetrical (i.e., Tik tac toe)",Challenge (Testing physical or mental abilities against others or self),N/A,Interview; Usability testing; Survey,Structured interview,Not Applicable,Not Applicable,Think aloud,Virtual Reality,Unknown,Blind or low vision (BLV),People with disabilities,User evaluation with stakeholders with disabilities,No,Undisclosed,Other,Artifact,,10,0,0,0,0,0,,4,0,0,0,0,0,6,0,0,0,0,0,0,0,0,0,0,0,0,0,0,0,0,0,0,0,0,0,0,0,0,0,0,0,0,0,,N/A,0,0,0,0,0,N/A,0,0,0,0,0,N/A,0,0,0,0,0,N/A,0,0,0,0,0,N/A,0,0,0,0,0,N/A,0,0,0,0,0,,0,0,0,0,0,0,0,0,0,0,0,0,0,0,0,0,0,0,0,0,0,0,0,0,7,0,0,0,0,0,2,0,0,0,0,0,1,0,0,0,0,0,0,0,0,0,0,0,0,0,0,0,"0
",0,0,0,0,0,0,0,USA,N/A
161,Pires 2019,A tangible math game for visually impaired children,Consensus,10.1145/3308561.3354596,A tangible math game for visually impaired children,Ana Cristina Pires,2019,3,,"Mostly utility first (i.e., primary utilitarian mechanic designed first)","Game with rigid rules (i.e., video game)","Entirely skill-based (i.e., trivia, sports)","Entirely Solo (i.e., Solitaire)","Follows a set of steps (i.e., Viticulture's dynamic turn ordering)","Entirely Synchronous (i.e., RTS game)","Entirely Competitive (i.e., Spit card game)","Entirely Symetrical (i.e., Tik tac toe)",Challenge (Testing physical or mental abilities against others or self),"Agencia Nacional de Investigación e Innovación, Fundación Ceibal, Espacio Interdisciplinario, Uruguay, FCT-Fundacao para a Ciencia e a Tecnologia",Interview; Workshop or design session,Semi-structured interview,Prototyping,Not Applicable,Not Applicable,Tangible Interface; PC,School,Blind or low vision (BLV),"People with disabilities; Specialists (e.g., therapists, teachers)",Participatory design with stakeholders without disabilities; Participatory design with stakeholders with disabilities,No,"Convienience sampling (i.e., Day program)",Education,Artifact,,11,7,0,0,0,0,,N/A,N/A,0,0,0,0,N/A,N/A,0,0,0,0,N/A,N/A,0,0,0,0,N/A,N/A,0,0,0,0,N/A,N/A,0,0,0,0,N/A,N/A,0,0,0,0,,N/A,N/A,0,0,0,0,N/A,N/A,0,0,0,0,N/A,N/A,0,0,0,0,N/A,N/A,0,0,0,0,N/A,N/A,0,0,0,0,N/A,N/A,0,0,0,0,,0,0,0,0,0,0,0,0,0,0,0,0,11,0,0,0,0,0,0,0,0,0,0,0,0,0,0,0,0,0,0,0,0,0,0,0,0,0,0,0,0,0,0,0,0,0,0,0,11,7,0,0,0,0,0,0,0,0,0,0,Portugal,"Uruguay, Spain"
141,CavazosQuero 2018,An interactive multimodal guide to improve art accessibility for blind people,Consensus,10.1145/3234695.3241033,An interactive multimodal guide to improve art accessibility for blind people,Luis Cavazos Quero,2018,3,,"Totally fun first (i.e., Entertainment game reappropriated)","Unstructured play (i.e., no rules, making art)",Not Applicable,"Mostly Solo, but can play against AI (i.e., Single player StarCraft)","Most actions can be taken at any time, but there are some phases (i.e., PvP death reset timer)","Mostly Synchronous with few asychronous affordances (i.e., League of Legends)","Entirely Collaborative (i.e., Pandemic)","Mostly Symmetrical (i.e., Uno)","Sensory (i.e., kaleidoscope)","NRF, MSIT",Interview; Usability testing,Semi-structured interview,Not Applicable,Not Applicable,Exert analysis,Tangible Interface,Research lab,Blind or low vision (BLV),People with disabilities,Participatory design with stakeholders with disabilities; User evaluation with stakeholders with disabilities,No,Undisclosed,Increasing physical access,Artifact,,8,N/A,N/A,N/A,N/A,N/A,,N/A,N/A,N/A,N/A,N/A,N/A,N/A,N/A,N/A,N/A,N/A,N/A,N/A,N/A,N/A,N/A,N/A,N/A,N/A,N/A,N/A,N/A,N/A,N/A,N/A,N/A,N/A,N/A,N/A,N/A,N/A,N/A,N/A,N/A,N/A,N/A,,N/A,N/A,N/A,N/A,N/A,N/A,N/A,N/A,N/A,N/A,N/A,N/A,N/A,N/A,N/A,N/A,N/A,N/A,N/A,N/A,N/A,N/A,N/A,N/A,N/A,N/A,N/A,N/A,N/A,N/A,N/A,N/A,N/A,N/A,N/A,N/A,,N/A,N/A,N/A,N/A,N/A,N/A,N/A,N/A,N/A,N/A,N/A,N/A,N/A,N/A,N/A,N/A,N/A,N/A,N/A,N/A,N/A,N/A,N/A,N/A,N/A,N/A,N/A,N/A,N/A,N/A,N/A,N/A,N/A,N/A,N/A,N/A,N/A,N/A,N/A,N/A,N/A,N/A,N/A,N/A,N/A,N/A,N/A,N/A,8,N/A,N/A,N/A,N/A,N/A,N/A,N/A,N/A,N/A,N/A,N/A,South Korea,N/A
138,Constantin 2018,Toward a technology-based tool to support idea generation during participatory design with children with autism spectrum disorders,Consensus,10.1145/3234695.3240995,Toward a technology-based tool to support idea generation during participatory design with children with autism spectrum disorders,Aurora Constantin ,2018,3,N/A,"Totally utility first (i.e., made by clinicians, fun incorporated later)","Flexible structure with rules (i.e., improv)","Entirely skill-based (i.e., trivia, sports)","Entirely Solo (i.e., Solitaire)","Most actions can be taken at any time, but there are some phases (i.e., PvP death reset timer)","Entirely Synchronous (i.e., RTS game)","Entirely Collaborative (i.e., Pandemic)","Mostly Symmetrical (i.e., Uno)","Construction (i.e., Music, painting, building)",N/A,Interview; Workshop or design session; Focus group,Structured interview,Prototyping; Mock-up,Not Applicable,Not Applicable,Tablet,Unknown,Autism,"Specialists (e.g., therapists, teachers); People without disabilities",Participatory design with stakeholders without disabilities,No,Undisclosed,Supporting communication,Artifact,,0,15,0,0,0,0,,0,N/A,0,0,0,0,0,N/A,0,0,0,0,0,N/A,0,0,0,0,0,N/A,0,0,0,0,0,N/A,0,0,0,0,0,N/A,0,0,0,0,,0,N/A,0,0,0,0,0,N/A,0,0,0,0,0,N/A,0,0,0,0,0,N/A,0,0,0,0,0,N/A,0,0,0,0,0,N/A,0,0,0,0,,0,N/A,0,0,0,0,0,N/A,0,0,0,0,0,N/A,0,0,0,0,0,N/A,0,0,0,0,0,N/A,0,0,0,0,0,N/A,0,0,0,0,0,N/A,0,0,0,0,0,N/A,0,0,0,0,0,N/A,0,0,0,0,0,N/A,0,0,0,0,United Kingdom,USA
134,Friedman 2018,Using a telepresence robot to improve self-efficacy of people with developmental disabilities,Consensus,10.1145/3234695.3240985,Using a telepresence robot to improve self-efficacy of people with developmental disabilities,Natalie Friedman,2018,3,N/A,"Totally utility first (i.e., made by clinicians, fun incorporated later)","Unstructured play (i.e., no rules, making art)","Entirely skill-based (i.e., trivia, sports)","Mix of solo and social affordances (i.e., Animal Crossing)","Entirely Simultaneous (i.e., race)","Entirely Synchronous (i.e., RTS game)","Entirely Collaborative (i.e., Pandemic)","Entirely Asymetrical (i.e., Keep talking nobody explodes)","Sensory (i.e., kaleidoscope)",N/A,Interview; Field study; Case study,Semi-structured interview,Not Applicable,Ethnography,Not Applicable,Robot,"Public space (i.e., Bowling alley)",Intellectual or developmental disability (IDD),People with disabilities,User evaluation with stakeholders with disabilities,No,"Convienience sampling (i.e., Day program)",Increasing independence; Increasing physical access; Increasing opportunities for enrichment ,Empirical; Survey,,6,0,0,0,0,0,,5,N/A,N/A,N/A,N/A,N/A,1,N/A,N/A,N/A,N/A,N/A,N/A,N/A,N/A,N/A,N/A,N/A,N/A,N/A,N/A,N/A,N/A,N/A,N/A,N/A,N/A,N/A,N/A,N/A,N/A,N/A,N/A,N/A,N/A,N/A,,N/A,N/A,N/A,N/A,N/A,N/A,N/A,N/A,N/A,N/A,N/A,N/A,N/A,N/A,N/A,N/A,N/A,N/A,N/A,N/A,N/A,N/A,N/A,N/A,N/A,N/A,N/A,N/A,N/A,N/A,N/A,N/A,N/A,N/A,N/A,N/A,,N/A,N/A,N/A,N/A,N/A,N/A,N/A,N/A,N/A,N/A,N/A,N/A,N/A,N/A,N/A,N/A,N/A,N/A,N/A,N/A,N/A,N/A,N/A,N/A,N/A,N/A,N/A,N/A,N/A,N/A,N/A,N/A,N/A,N/A,N/A,N/A,N/A,N/A,N/A,N/A,N/A,N/A,N/A,N/A,N/A,N/A,N/A,N/A,6,N/A,N/A,N/A,N/A,N/A,N/A,N/A,N/A,N/A,N/A,N/A,USA,N/A
131,Ostiz-Blanco 2018,Using the musical multimedia tool ACMUS with people with severe mental disorders: A pilot study,Consensus,10.1145/3234695.3241016,Using the musical multimedia tool ACMUS with people with severe mental disorders: A pilot study,Mikel Ostiz-Blanco,2018,3,,"Mostly utility first (i.e., primary utilitarian mechanic designed first)","Unstructured play (i.e., no rules, making art)","Equally skill and chance based (i.e., Catan)","Mix of solo and social affordances (i.e., Animal Crossing)","Most actions can be taken at any time, but there are some phases (i.e., PvP death reset timer)","Entirely Synchronous (i.e., RTS game)","Mostly Collaborative (i.e., Animal Crossing)","Entirely Symetrical (i.e., Tik tac toe)","Construction (i.e., Music, painting, building)","Education Ministry of Spain, Alfa Gaviota",Field study; Controlled experiment; Survey,Not applicable,Not Applicable,Ethnography,Not Applicable,PC; Other: Interactive Whiteboard,"Disability community space (i.e., Day program)",Intellectual or developmental disability (IDD),People with disabilities,User evaluation with stakeholders with disabilities,No,"Convienience sampling (i.e., Day program)",Education; Increasing opportunities for enrichment ,Artifact,,12,0,0,0,0,0,,8,0,0,0,0,0,4,0,0,0,0,0,0,0,0,0,0,0,0,0,0,0,0,0,0,0,0,0,0,0,0,0,0,0,0,0,,N/A,0,0,0,0,0,N/A,0,0,0,0,0,N/A,0,0,0,0,0,N/A,0,0,0,0,0,N/A,0,0,0,0,0,N/A,0,0,0,0,0,,0,0,0,0,0,0,0,0,0,0,0,0,0,0,0,0,0,0,0,0,0,0,0,0,0,0,0,0,0,0,0,0,0,0,0,0,0,0,0,0,0,0,0,0,0,0,0,0,12,0,0,0,0,0,0,0,0,0,0,0,Spain,N/A
128,Aruanno 2018,HoloLearn: Wearable mixed reality for people with neurodevelopmental disorders (NDD),Consensus,https://doi.org/10.1145/3234695.3236351,HoloLearn: Wearable Mixed Reality for People with Neurodevelopmental Disorders (NDD) ,Beatrice Aruanno,2018,12,,"Totally utility first (i.e., made by clinicians, fun incorporated later)","Game with rigid rules (i.e., video game)","Entirely skill-based (i.e., trivia, sports)","Mostly Solo, but can play against AI (i.e., Single player StarCraft)","Entirely Simultaneous (i.e., race)","Entirely Synchronous (i.e., RTS game)","Entirely Competitive (i.e., Spit card game)","Entirely Asymetrical (i.e., Keep talking nobody explodes)","Sensory (i.e., kaleidoscope); Challenge (Testing physical or mental abilities against others or self)",N/A,Interview; Field study; Focus group; Controlled experiment,Structured interview,Not Applicable,Ethnography,Exert analysis,Augmented Reality,"Disability community space (i.e., Day program)",Intellectual or developmental disability (IDD),"People with disabilities; Caregivers; Specialists (e.g., therapists, teachers)",Participatory design with stakeholders without disabilities; User evaluation with stakeholders without disabilities; User evaluation with stakeholders with disabilities,No,"Convienience sampling (i.e., Day program)",Increasing independence,Artifact,,20,2,0,0,3,0,,10,N/A,0,0,N/A,0,10,N/A,0,0,N/A,0,0,N/A,0,0,N/A,0,0,N/A,0,0,N/A,0,,N/A,0,0,N/A,0,0,N/A,0,0,N/A,0,,N/A,N/A,0,0,N/A,0,N/A,N/A,0,0,N/A,0,N/A,N/A,0,0,N/A,0,N/A,N/A,0,0,N/A,0,N/A,N/A,0,0,N/A,0,N/A,N/A,0,0,N/A,0,,0,0,0,0,0,0,0,0,0,0,0,0,0,0,0,0,0,0,1,0,0,0,0,0,4,0,0,0,0,0,14,0,0,0,0,0,1,0,0,0,0,0,0,0,0,0,0,0,0,2,0,0,3,0,0,0,0,0,0,0,Italy,N/A
