575,Mahmud 2006,A mixed method for evaluating input devices with older persons,Consensus,10.1145/1168987.1169063,A mixed method for evaluating input devices with older persons,Murni Mahmud,2006,2,,"Totally utility first (i.e., made by clinicians, fun incorporated later)","Game with rigid rules (i.e., video game)","Mostly skill-based (i.e.,  Mario Cart)","Entirely Solo (i.e., Solitaire)","Entirely Turn-based (i.e., Tic Tak Toe)","Entirely Synchronous (i.e., RTS game)",Not Applicable,Not Applicable,Challenge (Testing physical or mental abilities against others or self),,Controlled experiment; Survey,Not applicable,Not Applicable,Not Applicable,Not Applicable,Mobile; Tablet; PC,Research lab,Older adult,Older adults,User evaluation with stakeholders with disabilities,No,Undisclosed,Increasing understanding of users,Empirical,,0,0,0,12,0,0,,N/A,N/A,N/A,N/A,N/A,N/A,N/A,N/A,N/A,N/A,N/A,N/A,N/A,N/A,N/A,N/A,N/A,N/A,N/A,N/A,N/A,N/A,N/A,N/A,N/A,N/A,N/A,N/A,N/A,N/A,N/A,N/A,N/A,N/A,N/A,N/A,,N/A,N/A,N/A,N/A,N/A,N/A,N/A,N/A,N/A,N/A,N/A,N/A,N/A,N/A,N/A,N/A,N/A,N/A,N/A,N/A,N/A,N/A,N/A,N/A,N/A,N/A,N/A,N/A,N/A,N/A,N/A,N/A,N/A,N/A,N/A,N/A,,N/A,N/A,N/A,N/A,N/A,N/A,N/A,N/A,N/A,N/A,N/A,N/A,N/A,N/A,N/A,N/A,N/A,N/A,"N/A
",N/A,N/A,N/A,N/A,N/A,N/A,N/A,N/A,N/A,N/A,N/A,N/A,N/A,N/A,N/A,N/A,N/A,N/A,N/A,N/A,N/A,N/A,N/A,N/A,N/A,N/A,N/A,N/A,N/A,N/A,N/A,N/A,12,N/A,N/A,N/A,N/A,N/A,N/A,N/A,N/A,UK,N/A
573,Morelli 2010,Vi-bowling: a tactile spatial exergame for individuals with visual impairments,Consensus,10.1145/1878803.1878836,Vi-bowling: a tactile spatial exergame for individuals with visual impairments,Tony Morelli,2010,8,,"Totally fun first (i.e., Entertainment game reappropriated)","Game with rigid rules (i.e., video game)","Entirely skill-based (i.e., trivia, sports)","Mostly Solo, but can play against AI (i.e., Single player StarCraft)","Entirely Turn-based (i.e., Tic Tak Toe)","Entirely Synchronous (i.e., RTS game)","Entirely Competitive (i.e., Spit card game)","Mostly Symmetrical (i.e., Uno)",Challenge (Testing physical or mental abilities against others or self),N/A,Interview; Usability testing; Case study; Controlled experiment,Structured interview,Not Applicable,Not Applicable,Exert analysis,Wearable; Tangible Interface; Game Console,Unknown,Blind or low vision (BLV),People with disabilities; Older adults,User evaluation with stakeholders with disabilities,No,"Email; Convienience sampling (i.e., Day program)",Increasing physical access; Increasing opportunities for enrichment ,Empirical; Artifact,,6,0,0,3,0,0,,4,N/A,N/A,2,N/A,N/A,2,N/A,N/A,1,N/A,N/A,N/A,N/A,N/A,N/A,N/A,N/A,N/A,N/A,N/A,N/A,N/A,N/A,N/A,N/A,N/A,N/A,N/A,N/A,N/A,N/A,N/A,N/A,N/A,N/A,,N/A,N/A,N/A,N/A,N/A,N/A,N/A,N/A,N/A,N/A,N/A,N/A,N/A,N/A,N/A,N/A,N/A,N/A,N/A,N/A,N/A,N/A,N/A,N/A,N/A,N/A,N/A,N/A,N/A,N/A,N/A,N/A,N/A,N/A,N/A,N/A,,N/A,N/A,N/A,N/A,N/A,N/A,N/A,N/A,N/A,N/A,N/A,N/A,N/A,N/A,N/A,N/A,N/A,N/A,N/A,N/A,N/A,N/A,N/A,N/A,N/A,N/A,N/A,N/A,N/A,N/A,2,N/A,N/A,0,N/A,N/A,1,N/A,N/A,1,N/A,N/A,3,N/A,N/A,2,N/A,N/A,N/A,N/A,N/A,N/A,N/A,N/A,N/A,N/A,N/A,N/A,N/A,N/A,United States,N/A
572,Trinh 2011,Using a computer intervention to support phonological awareness development of nonspeaking adults,Consensus,10.1145/2049536.2049632,Using a computer intervention to support phonological awareness development of nonspeaking adults,Ha Trinh,2011,2,,"Totally utility first (i.e., made by clinicians, fun incorporated later)","Game with rigid rules (i.e., video game)","Entirely skill-based (i.e., trivia, sports)","Entirely Solo (i.e., Solitaire)","Follows a set of steps (i.e., Viticulture's dynamic turn ordering)","Entirely Synchronous (i.e., RTS game)","Entirely Competitive (i.e., Spit card game)","Entirely Symetrical (i.e., Tik tac toe)",Challenge (Testing physical or mental abilities against others or self),SICSA,Controlled experiment,Not applicable,Not Applicable,Not Applicable,Not Applicable,Tablet,Unknown,Motor of physical impairment; Communication / Speech,"People with disabilities; Specialists (e.g., therapists, teachers)",User evaluation with stakeholders without disabilities; User evaluation with stakeholders with disabilities,No,Undisclosed,Supporting communication; Education,Artifact,,3,1,0,0,0,0,,0,0,0,0,0,0,0,0,0,0,0,0,0,0,0,0,0,0,0,0,0,0,0,0,0,0,0,0,0,0,0,0,0,0,0,0,, N/A, N/A, N/A, N/A, N/A, N/A, N/A, N/A, N/A, N/A, N/A, N/A, N/A, N/A, N/A, N/A, N/A, N/A, N/A, N/A, N/A, N/A, N/A, N/A, N/A, N/A, N/A, N/A, N/A, N/A, N/A, N/A, N/A, N/A, N/A, N/A,,0,0,0,0,0,0,0,0,0,0,0,0,0,0,0,0,0,0,0,0,0,0,0,0,0,0,0,0,0,0,0,0,0,0,0,0,3,0,0,0,0,0,0,0,0,0,0,0,0,0,0,0,0,0,0,0,0,0,0,0,United Kingdom,
571,Rector 2013,Eyes-free yoga: an exergame using depth cameras for blind &amp; low vision exercise,Consensus,10.1145/2513383.2513392,Eyes-free yoga: an exergame using depth cameras for blind &amp; low vision exercise,Kyle Rector,2013,8,,"Mostly utility first (i.e., primary utilitarian mechanic designed first)","Game with rigid rules (i.e., video game)","Entirely skill-based (i.e., trivia, sports)","Entirely Solo (i.e., Solitaire)","Follows a set of steps (i.e., Viticulture's dynamic turn ordering)","Entirely Synchronous (i.e., RTS game)","Entirely Competitive (i.e., Spit card game)","Entirely Symetrical (i.e., Tik tac toe)",Challenge (Testing physical or mental abilities against others or self),"Kynamatrix Innovation through Collaboration Grant, ARCS foundation, NSF",Interview; Usability testing; Controlled experiment; Survey,Semi-structured interview,Not Applicable,Not Applicable,Exert analysis,PC; Game Console,Research lab,Blind or low vision (BLV),"People with disabilities; Specialists (e.g., therapists, teachers)",User evaluation with stakeholders with disabilities,No,"Email; Convienience sampling (i.e., Day program)",Increasing independence; Increasing physical access; Education,Empirical; Artifact,,16,4,0,0,0,0,,8,N/A,N/A,N/A,N/A,N/A,8,N/A,N/A,N/A,N/A,N/A,N/A,N/A,N/A,N/A,N/A,N/A,N/A,N/A,N/A,N/A,N/A,N/A,N/A,N/A,N/A,N/A,N/A,N/A,N/A,N/A,N/A,N/A,N/A,N/A,,N/A,N/A,N/A,N/A,N/A,N/A,N/A,N/A,N/A,N/A,N/A,N/A,N/A,N/A,N/A,N/A,N/A,N/A,N/A,N/A,N/A,N/A,N/A,N/A,N/A,N/A,N/A,N/A,N/A,N/A,N/A,N/A,N/A,N/A,N/A,N/A,,N/A,N/A,N/A,N/A,N/A,N/A,N/A,N/A,N/A,N/A,N/A,N/A,N/A,N/A,N/A,N/A,N/A,N/A,N/A,N/A,N/A,N/A,N/A,N/A,N/A,N/A,N/A,N/A,N/A,N/A,N/A,N/A,N/A,N/A,N/A,N/A,N/A,N/A,N/A,N/A,N/A,N/A,N/A,N/A,N/A,N/A,N/A,N/A,N/A,N/A,N/A,N/A,N/A,N/A,N/A,N/A,N/A,N/A,N/A,N/A,United States,N/A
570,Ye 2012,Liberi and the racer bike: exergaming technology for children with cerebral palsy,Consensus,10.1145/2384916.2384965,Liberi and the racer bike: exergaming technology for children with cerebral palsy,Zi Ye,2012,2,N/A,"Mostly utility first (i.e., primary utilitarian mechanic designed first)","Game with rigid rules (i.e., video game)","Mostly skill-based (i.e.,  Mario Cart)","Mix of solo and social affordances (i.e., Animal Crossing)","Entirely Simultaneous (i.e., race)","Mostly Synchronous with few asychronous affordances (i.e., League of Legends)","Mix of competitive and collaborative (i.e., Mario party 2 vs 2 mini games)","Entirely Symetrical (i.e., Tik tac toe)",Challenge (Testing physical or mental abilities against others or self),"NSERC 
Research Tools and Instruments grant",Workshop or design session; Usability testing,Not applicable,Design probe,Not Applicable,Exert analysis,Tangible Interface; PC,Clinic,Motor of physical impairment,"People with disabilities; Specialists (e.g., therapists, teachers)",Participatory design with stakeholders without disabilities; User evaluation with stakeholders without disabilities; User evaluation with stakeholders with disabilities,No,Clinic,Personal informatics and changing behavior,Artifact,,8,N/A,N/A,N/A,N/A,N/A,,N/A,N/A,N/A,N/A,N/A,N/A,N/A,N/A,N/A,N/A,N/A,N/A,N/A,N/A,N/A,N/A,N/A,N/A,N/A,N/A,N/A,N/A,N/A,N/A,N/A,N/A,N/A,N/A,N/A,N/A,N/A,N/A,N/A,N/A,N/A,N/A,,N/A,N/A,N/A,N/A,N/A,N/A,N/A,N/A,N/A,N/A,N/A,N/A,N/A,N/A,N/A,N/A,N/A,N/A,N/A,N/A,N/A,N/A,N/A,N/A,N/A,N/A,N/A,N/A,N/A,N/A,N/A,N/A,N/A,N/A,N/A,N/A,,N/A,N/A,N/A,N/A,N/A,N/A,N/A,N/A,N/A,N/A,N/A,N/A,N/A,N/A,N/A,N/A,N/A,N/A,N/A,N/A,N/A,N/A,N/A,N/A,N/A,N/A,N/A,N/A,N/A,N/A,N/A,N/A,N/A,N/A,N/A,N/A,N/A,N/A,N/A,N/A,N/A,N/A,N/A,N/A,N/A,N/A,N/A,N/A,N/A,N/A,N/A,N/A,N/A,N/A,8,N/A,N/A,N/A,N/A,N/A,Canada,N/A
569,Plaisant 2000,A storytelling robot for pediatric rehabilitation,Consensus,10.1145/354324.354338,A Storytelling Robot for Pediatric Rehabilitation ,Catherine Plaisan,2000,6,,"Mostly utility first (i.e., primary utilitarian mechanic designed first)","Flexible structure with rules (i.e., improv)","Entirely skill-based (i.e., trivia, sports)","Mix of solo and social affordances (i.e., Animal Crossing)","Most actions can be taken at any time, but there are some phases (i.e., PvP death reset timer)","Mostly Synchronous with few asychronous affordances (i.e., League of Legends)","Mostly Collaborative (i.e., Animal Crossing)","Entirely Symetrical (i.e., Tik tac toe)","Construction (i.e., Music, painting, building); Challenge (Testing physical or mental abilities against others or self)","DOE, National Institute on Disability and Rehabilitation Research",Workshop or design session; Case study,Not applicable,Design probe; Prototyping,Not Applicable,Not Applicable,Robot,Clinic; Home,General disability or accessibility,"People with disabilities; Specialists (e.g., therapists, teachers)",Participatory design with stakeholders without disabilities; Participatory design with stakeholders with disabilities; User evaluation with stakeholders without disabilities; User evaluation with stakeholders with disabilities,No,"Convienience sampling (i.e., Day program)",Personal informatics and changing behavior; Education,Artifact,,4,0,1,0,0,0,,N/A,0,0,0,0,0,N/A,0,0,0,0,0,N/A,0,0,0,0,0,N/A,0,0,0,0,0,N/A,0,0,0,0,0,N/A,0,0,0,0,0,,N/A,0,0,0,0,0,N/A,0,"0
",0,0,0,N/A,0,0,0,0,0,N/A,0,0,0,0,0,N/A,0,0,0,0,0,N/A,0,0,0,0,0,,0,0,0,0,0,0,N/A,0,0,0,0,0,N/A,0,0,0,0,0,N/A,0,0,0,0,0,0,0,0,0,0,0,0,0,0,0,0,0,0,0,0,0,0,0,0,0,0,0,0,0,0,0,0,0,0,0,4,0,0,0,0,0,USA,N/A
568,Sánchez 2005,3D sound interactive environments for problem solving,Consensus,10.1145/1090785.1090817,3D sound interactive environments for problem solving,Jaime Sánchez,2005,7,,"Mostly fun first (i.e., Design workshop with disabled stakeholders)","Flexible game (i.e., board game with house rules)","Equally skill and chance based (i.e., Catan)","Entirely Solo (i.e., Solitaire)","Most actions can be taken at any time, but there are some phases (i.e., PvP death reset timer)","Entirely Synchronous (i.e., RTS game)","Entirely Competitive (i.e., Spit card game)","Entirely Symetrical (i.e., Tik tac toe)",Challenge (Testing physical or mental abilities against others or self),Chilean National Fund of Science and Technology,Usability testing; Survey,Contextual inquiry,Not Applicable,Not Applicable,Exert analysis,PC,School,Blind or low vision (BLV),People with disabilities,User evaluation with stakeholders with disabilities,No,"Convienience sampling (i.e., Day program)",Increasing digital access; Education,Artifact,,6,3,0,0,0,0,,4,0,0,0,0,0,2,0,0,0,0,0,0,0,0,0,0,0,0,0,0,0,0,0,0,0,0,0,0,0,0,0,0,0,0,0,,0,0,0,0,0,0,0,0,0,0,0,0,0,0,0,0,0,0,0,0,0,0,0,0,0,0,0,0,0,0,0,0,0,0,0,0,,0,0,0,0,0,0,0,0,0,0,0,0,0,0,0,0,0,0,6,0,0,0,0,0,0,0,0,0,0,0,0,0,0,0,0,0,0,0,0,0,0,0,0,0,0,0,0,0,0,0,0,0,0,0,6,0,0,0,0,0,Chile,
567,Trewin 2008,PowerUp: an accessible virtual world,Consensus,10.1145/1414471.1414504,PowerUp: an accessible virtual world,Shari Trewin,2008,8,,"Both fun and utility first (i.e., Design workshop with diverse stakeholders)","Game with rigid rules (i.e., video game)","Mostly skill-based (i.e.,  Mario Cart)","Mix of solo and social affordances (i.e., Animal Crossing)","Most actions can be taken at any time, but there are some phases (i.e., PvP death reset timer)","Entirely Synchronous (i.e., RTS game)","Entirely Collaborative (i.e., Pandemic)","Entirely Symetrical (i.e., Tik tac toe)","Fantasy (i.e., role playing); Challenge (Testing physical or mental abilities against others or self)", IBM development team,Usability testing; Case study; Survey,Not applicable,Not Applicable,Not Applicable,Exert analysis; Think aloud; Heuristic analysis ,PC; Game Console,Research lab,Blind or low vision (BLV),People with disabilities,User evaluation with stakeholders with disabilities,No,"Convienience sampling (i.e., Day program)",Increasing digital access; Increasing understanding of users; Increasing opportunities for enrichment ,Empirical; Artifact,,32,N/A,N/A,N/A,N/A,N/A,,26,N/A,N/A,N/A,N/A,N/A,6,N/A,N/A,N/A,N/A,N/A,N/A,N/A,N/A,N/A,N/A,N/A,N/A,N/A,N/A,N/A,N/A,N/A,N/A,N/A,N/A,N/A,N/A,N/A,N/A,N/A,N/A,N/A,N/A,N/A,,N/A,N/A,N/A,N/A,N/A,N/A,N/A,N/A,N/A,N/A,N/A,N/A,N/A,N/A,N/A,N/A,N/A,N/A,N/A,N/A,N/A,N/A,N/A,N/A,N/A,N/A,N/A,N/A,N/A,N/A,N/A,N/A,N/A,N/A,N/A,N/A,,N/A,N/A,N/A,N/A,N/A,N/A,N/A,N/A,N/A,N/A,N/A,N/A,N/A,N/A,N/A,N/A,N/A,N/A,7,N/A,N/A,N/A,N/A,N/A,N/A,N/A,N/A,N/A,N/A,N/A,N/A,N/A,N/A,N/A,N/A,N/A,N/A,N/A,N/A,N/A,N/A,N/A,N/A,N/A,N/A,N/A,N/A,N/A,25,N/A,N/A,N/A,N/A,N/A,N/A,N/A,N/A,N/A,N/A,N/A,USA,
566,Yuan 2008,Blind hero: enabling guitar hero for the visually impaired,Consensus,10.1145/1414471.1414503,Blind hero: enabling guitar hero for the visually impaired,Bei Yuan,2008,8,N/A,"Totally fun first (i.e., Entertainment game reappropriated)","Game with rigid rules (i.e., video game)","Entirely skill-based (i.e., trivia, sports)","Entirely Solo (i.e., Solitaire)","Entirely Simultaneous (i.e., race)","Entirely Synchronous (i.e., RTS game)","Entirely Competitive (i.e., Spit card game)","Mostly Symmetrical (i.e., Uno)","Sensory (i.e., kaleidoscope); Challenge (Testing physical or mental abilities against others or self)",N/A,Usability testing; Controlled experiment; Telemetry / Big data / CSCW,Not applicable,Not Applicable,Not Applicable,Exert analysis; Think aloud; Heuristic analysis ,Wearable; Tangible Interface; PC; Game Console,Research lab,Blind or low vision (BLV),People with disabilities; People without disabilities,User evaluation with stakeholders without disabilities; User evaluation with stakeholders with disabilities,No,Undisclosed,Increasing digital access; Increasing opportunities for enrichment ,Empirical; Artifact,,3,,9,,,,,,,,,,,,,,,,,,,,,,,,,,,,,,,,,,,,,,,,,,,,,,,,,,,,,,,,,,,,,,,,,,,,,,,,,,,,,,,,,,,,,,,,,,,,,,,,,,,,,,,,,,,,,,,,,,,,,,,,,,,,,,,,,,,,,,,,,,,USA,N/A
565,Allman 2009,Rock Vibe: Rock Band® computer games for people with no or limited vision,Consensus,https://doi.org/10.1145/1639642.1639653,Rock Vibe: Rock Band® computer games for people with no or limited vision,Troy Allman,2009,8,N/A,"Totally fun first (i.e., Entertainment game reappropriated)","Game with rigid rules (i.e., video game)","Entirely skill-based (i.e., trivia, sports)","Mix of solo and social affordances (i.e., Animal Crossing)","Entirely Simultaneous (i.e., race)","Entirely Synchronous (i.e., RTS game)","Mix of competitive and collaborative (i.e., Mario party 2 vs 2 mini games)","Entirely Symetrical (i.e., Tik tac toe)","Sensory (i.e., kaleidoscope); Fantasy (i.e., role playing); Construction (i.e., Music, painting, building); Challenge (Testing physical or mental abilities against others or self)",N/A,Interview; Workshop or design session; Usability testing; Focus group; Controlled experiment,Semi-structured interview,Design probe,Not Applicable,Heuristic analysis ,Wearable; Assistive Device; Tangible Interface; PC,Research lab,Blind or low vision (BLV),People with disabilities,User evaluation with stakeholders with disabilities,No,"Convienience sampling (i.e., Day program)",Increasing digital access; Increasing opportunities for enrichment ,Empirical; Artifact,,29,0,0,0,0,4,,8,0,0,0,0,1,8,0,0,0,0,3,0,0,0,0,0,0,0,0,0,0,0,0,0,0,0,0,0,0,13,0,0,0,0,0,,N/A,0,0,0,0,N/A,N/A,0,0,0,0,N/A,N/A,0,0,0,0,N/A,N/A,0,0,0,0,N/A,N/A,0,0,0,0,N/A,N/A,0,0,0,0,N/A,,N/A,0,0,0,0,0,N/A,0,0,0,0,0,N/A,0,0,0,0,0,N/A,0,0,0,0,0,N/A,0,0,0,0,0,N/A,0,0,0,0,0,N/A,0,0,0,0,0,N/A,0,0,0,0,0,N/A,0,0,0,0,4,N/A,0,0,0,0,0,USA,N/A
564,Norte 2008,Sudoku access: a sudoku game for people with motor disabilities,Consensus,10.1145/1414471.1414502,Sudoku Access: A Sudoku Game for People with Motor Disabilities,Stéphane Norte,2008,7,,"Totally fun first (i.e., Entertainment game reappropriated)","Game with rigid rules (i.e., video game)","Entirely skill-based (i.e., trivia, sports)","Entirely Solo (i.e., Solitaire)","Entirely Simultaneous (i.e., race)","Entirely Synchronous (i.e., RTS game)","Entirely Competitive (i.e., Spit card game)","Entirely Symetrical (i.e., Tik tac toe)",Challenge (Testing physical or mental abilities against others or self),FCT/MCTES,Usability testing,Not applicable,Not Applicable,Not Applicable,Exert analysis,PC,Unknown,Motor of physical impairment,People with disabilities; People without disabilities,User evaluation with stakeholders with disabilities,No,"Convienience sampling (i.e., Day program)",Increasing digital access,Artifact,,2,0,1,0,0,0,,0,0,1,0,0,0,2,0,0,0,0,0,0,0,0,0,0,0,0,0,0,0,"0
",0,0,0,0,0,0,0,0,0,0,0,0,0,,N/A,0,N/A,0,0,0,N/A,0,N/A,0,0,0,N/A,0,N/A,0,0,0,N/A,0,N/A,0,0,0,N/A,0,N/A,0,0,0,N/A,0,N/A,0,0,0,,0,0,0,0,0,0,0,0,0,0,0,0,0,0,0,0,0,0,2,0,1,0,0,0,0,0,0,0,0,0,0,0,0,0,0,0,0,0,0,0,0,0,0,0,0,0,0,0,0,0,0,0,0,0,0,0,0,0,0,0,Portugal,N/A
563,Kim 2011,TapBeats: accessible and mobile casual gaming,Consensus,10.1145/2049536.2049609,TapBeats: accessible and mobile casual gaming,Joy Kim,2011,2,N/A,"Totally fun first (i.e., Entertainment game reappropriated)","Game with rigid rules (i.e., video game)","Entirely skill-based (i.e., trivia, sports)","Entirely Solo (i.e., Solitaire)","Entirely Simultaneous (i.e., race)","Entirely Synchronous (i.e., RTS game)","Entirely Competitive (i.e., Spit card game)","Entirely Symetrical (i.e., Tik tac toe)","Construction (i.e., Music, painting, building); Challenge (Testing physical or mental abilities against others or self)",N/A,Field study; Usability testing,Not applicable,Not Applicable,Ethnography,Exert analysis,Mobile,School,Blind or low vision (BLV),People with disabilities,User evaluation with stakeholders with disabilities,No,"Convienience sampling (i.e., Day program)",Increasing digital access; Increasing opportunities for enrichment ,Artifact,,N/A,0,0,0,0,0,,N/A,0,0,0,0,0,N/A,0,0,0,0,0,N/A,0,0,0,0,0,N/A,0,0,0,0,0,N/A,0,0,0,0,0,N/A,0,0,0,0,0,,N/A,0,0,0,0,0,N/A,0,0,0,0,0,N/A,0,0,0,0,0,N/A,0,0,0,0,0,N/A,0,0,0,0,0,N/A,0,0,0,0,0,,0,0,0,0,0,0,0,0,0,0,0,0,0,0,0,0,0,0,N/A,0,0,0,0,0,N/A,0,0,0,0,0,N/A,0,0,0,0,0,N/A,0,0,0,0,0,N/A,0,0,0,0,0,N/A,0,0,0,0,0,N/A,0,0,0,0,0,USA,
562,Milne 2013,VBGhost: a braille-based educational smartphone game for children,Consensus,10.1145/2513383.2513396,VBGhost: a braille-based educational smartphone game for children,Lauren R. Milne,2013,2,,"Both fun and utility first (i.e., Design workshop with diverse stakeholders)","Game with rigid rules (i.e., video game)","Entirely skill-based (i.e., trivia, sports)","Mix of solo and social affordances (i.e., Animal Crossing)","Entirely Turn-based (i.e., Tic Tak Toe)","Mostly Synchronous with few asychronous affordances (i.e., League of Legends)","Entirely Competitive (i.e., Spit card game)","Entirely Symetrical (i.e., Tik tac toe)",Challenge (Testing physical or mental abilities against others or self),DOE,Workshop or design session,Not applicable,Prototyping,Not Applicable,Not Applicable,Mobile,School,Blind or low vision (BLV),People with disabilities,User evaluation with stakeholders with disabilities,No,"Convienience sampling (i.e., Day program)",Education; Increasing opportunities for enrichment ,Artifact,,0,0,0,0,0,0,,0,"0
",0,0,0,0,0,0,0,0,0,0,0,0,0,0,0,0,0,0,0,0,0,0,0,0,0,0,0,0,0,0,0,0,0,0,,0,0,0,0,0,0,0,0,0,0,0,0,0,0,0,0,0,0,0,0,0,0,0,0,0,0,0,0,0,0,0,0,0,0,0,0,,0,0,0,0,0,0,0,0,0,0,0,0,0,"0
",0,0,0,0,0,0,0,0,0,0,0,0,0,0,0,0,0,0,0,0,0,0,0,0,0,0,0,"
0",0,0,0,0,0,0,0,0,0,0,0,0,0,0,0,0,0,0,USA,N/A
561,Miller 2007,Finger dance: a sound game for blind people,Consensus,10.1145/1296843.1296898,Finger Dance: A sound game for blind people,Daniel Miller,2007,2,,"Totally fun first (i.e., Entertainment game reappropriated)","Game with rigid rules (i.e., video game)","Entirely skill-based (i.e., trivia, sports)","Entirely Solo (i.e., Solitaire)","Follows a set of steps (i.e., Viticulture's dynamic turn ordering)","Entirely Synchronous (i.e., RTS game)","Entirely Competitive (i.e., Spit card game)","Entirely Symetrical (i.e., Tik tac toe)",Challenge (Testing physical or mental abilities against others or self),,Workshop or design session; Usability testing,Not applicable,Design probe,Not Applicable,Exert analysis,PC,Unknown,Blind or low vision (BLV),People with disabilities; People without disabilities,Participatory design with stakeholders without disabilities; Participatory design with stakeholders with disabilities; User evaluation with stakeholders without disabilities; User evaluation with stakeholders with disabilities,No,"Convienience sampling (i.e., Day program)",Increasing opportunities for enrichment ,Artifact,,3,N/A,3,N/A,N/A,N/A,,N/A,N/A,N/A,N/A,N/A,N/A,N/A,N/A,N/A,N/A,N/A,N/A,N/A,N/A,N/A,N/A,N/A,N/A,N/A,N/A,N/A,N/A,N/A,N/A,N/A,N/A,N/A,N/A,N/A,N/A,N/A,N/A,N/A,N/A,N/A,N/A,,N/A,N/A,N/A,N/A,N/A,N/A,N/A,N/A,N/A,N/A,N/A,N/A,N/A,N/A,N/A,N/A,N/A,N/A,N/A,N/A,N/A,N/A,N/A,N/A,N/A,N/A,N/A,N/A,N/A,N/A,N/A,N/A,N/A,N/A,N/A,N/A,,N/A,N/A,N/A,N/A,N/A,N/A,N/A,N/A,N/A,N/A,N/A,N/A,N/A,N/A,N/A,N/A,N/A,N/A,N/A,N/A,N/A,N/A,N/A,N/A,N/A,N/A,N/A,N/A,N/A,N/A,N/A,N/A,N/A,N/A,N/A,N/A,N/A,N/A,N/A,N/A,N/A,N/A,N/A,N/A,N/A,N/A,N/A,N/A,N/A,N/A,N/A,N/A,N/A,N/A,N/A,N/A,N/A,N/A,N/A,N/A,USA,
560,Torrente 2012,Preliminary evaluation of three eyes-free interfaces for point-and-click computer games,Consensus,10.1145/2384916.2384985,Preliminary evaluation of three eyes-free interfaces for point-and-click computer games,Javier Torrente,2012,2,,"Totally utility first (i.e., made by clinicians, fun incorporated later)","Game with rigid rules (i.e., video game)","Entirely skill-based (i.e., trivia, sports)","Entirely Solo (i.e., Solitaire)","Entirely Simultaneous (i.e., race)","Entirely Synchronous (i.e., RTS game)","Entirely Competitive (i.e., Spit card game)","Entirely Symetrical (i.e., Tik tac toe)",Challenge (Testing physical or mental abilities against others or self),"Spanish Ministry of Science, European Commission, Complutense University, Regional Government of Madrid",Controlled experiment; Survey,Not applicable,Not Applicable,Not Applicable,Not Applicable,PC,Unknown,Blind or low vision (BLV),People with disabilities,User evaluation with stakeholders with disabilities,No,Undisclosed,Increasing digital access,Artifact,,2,0,0,0,0,0,,N/A,0,0,0,0,0,N/A,0,0,0,0,0,N/A,0,0,0,0,0,N/A,0,0,0,0,0,N/A,0,0,0,0,0,N/A,0,0,0,0,0,,N/A,0,0,0,0,0,N/A,0,0,0,0,0,N/A,0,0,0,0,0,N/A,0,0,0,0,0,N/A,0,0,0,0,0,N/A,0,0,0,0,0,,N/A,0,0,0,0,0,N/A,0,0,0,0,0,N/A,0,0,0,0,0,N/A,0,0,0,0,0,N/A,0,0,0,0,0,N/A,0,0,0,0,0,N/A,0,0,0,0,0,N/A,0,0,0,0,0,N/A,0,0,0,0,0,N/A,0,0,0,0,0,Spain,N/A
559,Kim 2013,Surveying the accessibility of touchscreen games for persons with motor impairments: a preliminary analysis,Consensus,10.1145/2513383.2513450,Surveying the Accessibility of Touchscreen Games for Persons with Motor Impairments: A Preliminary Analysis,Yoojin Kim,2013,2,,Not Applicable ,Not Applicable,Not Applicable,Not Applicable ,Not Applicable,Not Applicable,Not Applicable,Not Applicable,Not Applicable ,Google,Survey,Not applicable,Not Applicable,Not Applicable,Not Applicable,Tablet,Not applicable,Motor of physical impairment,No user involvement,Not applicable,No,No user involvement,Increasing understanding of users,Theoretical,,0,0,0,0,0,0,,N/A,N/A,N/A,N/A,N/A,N/A,"N/A
",N/A,N/A,N/A,"N/A
",N/A,N/A,N/A,N/A,N/A,N/A,N/A,N/A,N/A,N/A,N/A,N/A,N/A,N/A,N/A,"N/A
",N/A,N/A,N/A,N/A,"N/A
",N/A,N/A,N/A,N/A,,"N/A
",N/A,N/A,N/A,"N/A
",N/A,N/A,N/A,"N/A
",N/A,N/A,N/A,N/A,N/A,N/A,"N/A
",N/A,N/A,N/A,N/A,N/A,N/A,N/A,N/A,N/A,N/A,N/A,N/A,N/A,N/A,N/A,N/A,N/A,N/A,N/A,N/A,,N/A,"N/A
",N/A,"N/A
",N/A,N/A,N/A,N/A,N/A,"N/A
",N/A,N/A,N/A,N/A,N/A,N/A,N/A,N/A,N/A,N/A,N/A,N/A,N/A,"N/A
",N/A,N/A,N/A,N/A,"N/A
",N/A,N/A,N/A,N/A,N/A,N/A,N/A,N/A,N/A,N/A,N/A,N/A,N/A,N/A,N/A,N/A,"N/A
",N/A,"N/A
",N/A,N/A,N/A,N/A,N/A,N/A,"N/A
",N/A,"N/A
",N/A,"N/A
",N/A,USA,N/A
558,MoyàAlcover 2011,Use of serious games for motivational balance rehabilitation of cerebral palsy patients,Consensus,10.1145/2049536.2049615,Use of serious games for motivational balance rehabilitation of cerebral palsy patients,Biel Moyà-Alcover,2011,2,,"Totally utility first (i.e., made by clinicians, fun incorporated later)","Game with rigid rules (i.e., video game)","Entirely skill-based (i.e., trivia, sports)","Entirely Solo (i.e., Solitaire)","Most actions can be taken at any time, but there are some phases (i.e., PvP death reset timer)","Entirely Synchronous (i.e., RTS game)","Entirely Competitive (i.e., Spit card game)","Entirely Symetrical (i.e., Tik tac toe)",Challenge (Testing physical or mental abilities against others or self),"MAEC-AECID, FEDER",Workshop or design session; Field study,Not applicable,Prototyping,Ethnography,Not Applicable,PC,Clinic,Motor of physical impairment,People with disabilities,User evaluation with stakeholders with disabilities,No,Clinic,Personal informatics and changing behavior,Artifact,,4,0,0,0,0,0,,N/A,0,0,0,0,0,N/A,0,0,0,0,0,N/A,0,0,0,0,0,N/A,0,0,0,0,0,N/A,0,"0
",0,0,0,N/A,0,0,"0
",0,0,,N/A,0,"0
",0,"0
",0,N/A,0,0,0,0,0,N/A,0,"0
",0,0,0,N/A,0,0,0,0,0,N/A,0,"0
",0,0,0,N/A,0,0,0,0,0,,N/A,0,0,0,0,0,N/A,0,0,0,0,0,N/A,0,0,0,0,0,N/A,0,0,0,0,0,N/A,0,0,0,0,0,N/A,0,0,0,0,0,N/A,0,0,0,0,0,N/A,0,0,0,0,0,4,0,0,0,0,0,N/A,0,0,0,0,0,Spain,Cuba
