428,Collins 2023,“The guide has your back”: Exploring how sighted guides can enhance accessibility in social virtual reality for blind and low vision people,Consensus,10.1145/3597638.3608386,“The guide has your back”: Exploring how sighted guides can enhance accessibility in social virtual reality for blind and low vision people,Jazmin Collins and Crescentia Jung,2023,14,N/A,"Mostly utility first (i.e., primary utilitarian mechanic designed first)","Semi-structured play (i.e., playground game)","Equally skill and chance based (i.e., Catan)","Entirely social (i.e., Tag)","Entirely Simultaneous (i.e., race)","Entirely Synchronous (i.e., RTS game)","Entirely Collaborative (i.e., Pandemic)","Mostly Asymetrical (i.e., Tag)",Challenge (Testing physical or mental abilities against others or self),"NSF and Meta Platforms, Inc",Interview; Field study; Survey,Structured interview,Not Applicable,Ethnography,Not Applicable,Virtual Reality,"Public space (i.e., Bowling alley); Research lab",Blind or low vision (BLV),People with disabilities,User evaluation with stakeholders with disabilities,No,"Convienience sampling (i.e., Day program)",Increasing digital access; Increasing understanding of users,Artifact,,16,0,0,0,0,0,,10,N/A, N/A, N/A,N/A,N/A,6,N/A,N/A,N/A,N/A,N/A,N/A,N/A,N/A,N/A,N/A,N/A,N/A,N/A,N/A,N/A,N/A,N/A,N/A,N/A,N/A,N/A,N/A,N/A,N/A,N/A,N/A,N/A,N/A,N/A,,N/A,N/A,N/A,N/A,N/A,N/A,N/A,N/A,N/A,N/A,N/A,N/A,N/A,"N/A
",N/A,N/A,N/A,N/A,N/A,N/A,N/A,N/A,N/A,N/A,N/A,N/A,N/A,N/A,N/A,N/A,N/A,N/A,N/A,N/A,N/A,N/A,,0,0,0,0,0,0,0,0,0,0,0,0,0,0,0,0,0,0,0,0,0,0,0,0,0,0,0,0,0,0,7,0,0,0,0,0,9,"0
",0,0,0,0,0,0,0,0,0,0,0,0,0,0,0,0,0,0,0,0,0,0,USA,N/A
427,DeSilva 2023,Understanding challenges and opportunities in body movement education of people who are blind or have low vision,Consensus,10.1145/3597638.3608409,Understanding challenges and opportunities in body movement education of people who are blind or have low vision,Madhuka De Silva ,2023,19,,Not Applicable ,Not Applicable,Not Applicable,Not Applicable ,Not Applicable,Not Applicable,Not Applicable,Not Applicable,Not Applicable ,,Interview; Focus group; Survey,Semi-structured interview,Not Applicable,Not Applicable,Not Applicable,No Technology,Not applicable,Blind or low vision (BLV),"People with disabilities; Specialists (e.g., therapists, teachers)",Not applicable,No,"Email; Convienience sampling (i.e., Day program); Social Media",Increasing understanding of users,Survey,,25,14,0,0,0,0,,5,3,N/A,N/A,N/A,N/A,17,3,N/A,N/A,N/A,N/A,0,0,N/A,N/A,N/A,N/A,0,0,N/A,N/A,N/A,N/A,3,0,N/A,N/A,N/A,N/A,0,0,N/A,N/A,N/A,N/A,,N/A,N/A,N/A,N/A,N/A,N/A,N/A,N/A,N/A,N/A,N/A,N/A,N/A,N/A,N/A,N/A,N/A,N/A,N/A,N/A,N/A,N/A,N/A,N/A,N/A,N/A,N/A,N/A,N/A,N/A,N/A,N/A,N/A,N/A,N/A,N/A,,N/A,0,N/A,N/A,N/A,N/A,N/A,0,N/A,N/A,N/A,N/A,N/A,0,N/A,N/A,N/A,N/A,N/A,0,N/A,N/A,N/A,N/A,N/A,0,N/A,N/A,N/A,N/A,N/A,0,N/A,N/A,N/A,N/A,N/A,0,N/A,N/A,N/A,N/A,N/A,0,N/A,N/A,N/A,N/A,25,14,N/A,N/A,N/A,N/A,N/A,0,N/A,N/A,N/A,N/A,Australia,"USA, Canada, United Kingdom, Egypt, Netherlands"
426,Zhang 2023,A diary study in social virtual reality: Impact of avatars with disability signifiers on the social experiences of people with disabilities,Consensus,10.1145/3597638.3608388,A diary study in social virtual reality: Impact of avatars with disability signifiers on the social experiences of people with disabilities,Kexin Zhang,2023,17,,"Totally fun first (i.e., Entertainment game reappropriated)","Flexible game (i.e., board game with house rules)",Not Applicable,"Entirely social (i.e., Tag)","Entirely Simultaneous (i.e., race)","Mostly Synchronous with few asychronous affordances (i.e., League of Legends)",Not Applicable,"Entirely Symetrical (i.e., Tik tac toe)","Fantasy (i.e., role playing)","U.S. Department of Commerce, Wisconsin Alumni Research Foundation, University of Maryland, Baltimore County, Meta",Interview; Field study,Structured interview; Contextual inquiry,Not Applicable,Diary study,Not Applicable,Virtual Reality,Remote / Zoom,General disability or accessibility,People with disabilities,Not applicable,No,"Email; Convienience sampling (i.e., Day program); Snowball; Social Media",Increasing understanding of users,Empirical,,10,0,0,0,0,0,,5,N/A,N/A,N/A,N/A,N/A,4,N/A,N/A,N/A,N/A,N/A,N/A,N/A,N/A,N/A,N/A,N/A,N/A,N/A,N/A,N/A,N/A,N/A,1,N/A,N/A,N/A,N/A,N/A,N/A,N/A,N/A,N/A,N/A,N/A,,N/A,N/A,N/A,N/A,N/A,N/A,N/A,N/A,N/A,N/A,N/A,N/A,N/A,N/A,N/A,N/A,N/A,N/A,N/A,N/A,N/A,N/A,N/A,N/A,N/A,N/A,N/A,N/A,N/A,N/A,N/A,N/A,N/A,N/A,N/A,N/A,,N/A,N/A,N/A,N/A,N/A,N/A,N/A,N/A,N/A,N/A,N/A,N/A,N/A,N/A,N/A,N/A,N/A,N/A,N/A,N/A,N/A,N/A,N/A,N/A,N/A,N/A,N/A,N/A,N/A,N/A,N/A,N/A,N/A,N/A,N/A,N/A,N/A,N/A,N/A,N/A,N/A,N/A,N/A,N/A,N/A,N/A,N/A,N/A,10,N/A,N/A,N/A,N/A,N/A,N/A,N/A,N/A,N/A,N/A,N/A,USA,
423,Zhang 2023,Understanding digital content creation needs of blind and low vision people,Consensus,10.1145/3597638.3608387,Understanding digital content creation needs of blind and low vision people,Lotus Zhang,2023,15,"It talks about the potential designs for digital access, but barely mentions games or a game system.",Not Applicable ,Not Applicable,Not Applicable,Not Applicable ,Not Applicable,Not Applicable,Not Applicable,Not Applicable,"Construction (i.e., Music, painting, building)","University of Washington’s CREATE Center, Apple Inc.",Interview; Survey,Semi-structured interview,Not Applicable,Not Applicable,Not Applicable,No Technology,Remote / Zoom,Blind or low vision (BLV),People with disabilities,Not applicable,No,"Convienience sampling (i.e., Day program); Social Media",Increasing understanding of users,Empirical,,167,0,0,0,0,0,,68,0,0,0,0,0,94,0,0,0,0,0,0,0,0,0,0,0,0,0,0,0,0,0,2,0,0,0,0,0,1,0,0,0,0,0,,0,0,0,0,0,0,0,0,0,0,0,0,0,0,0,0,0,0,0,0,0,0,0,0,0,0,0,0,0,0,0,0,0,0,0,0,,N/A,0,0,0,0,0,N/A,0,0,0,0,0,N/A,0,0,0,0,0,N/A,0,0,0,0,0,3,0,0,0,0,0,3,0,0,0,0,0,9,0,0,0,0,0,N/A,0,0,0,0,0,152,0,0,0,0,0,N/A,0,0,0,0,0,USA,
422,Hossain 2023,Supporting ASL communication between hearing parents and deaf children,Consensus,10.1145/3597638.3614511,Supporting ASL communication between hearing parents and deaf children,Ekram Hossain,2023,5,N/A,"Totally utility first (i.e., made by clinicians, fun incorporated later)","Semi-structured play (i.e., playground game)","Mostly skill-based (i.e.,  Mario Cart)","Entirely social (i.e., Tag)","Entirely Simultaneous (i.e., race)","Entirely Synchronous (i.e., RTS game)","Entirely Collaborative (i.e., Pandemic)","Mostly Symmetrical (i.e., Uno)","Fantasy (i.e., role playing)","Google Inclusive Research Award, the National Science Foundation REU program, and Pump Primer II funds from the University of Rochester",Controlled experiment; Telemetry / Big data / CSCW,Not applicable,Not Applicable,Not Applicable,Not Applicable,Tablet; Augmented Reality,Research lab,Deaf or hard of hearing (DHH),People without disabilities,No representative user involvement,No,No user involvement,Supporting communication,Artifact,,0,0,2,0,0,0,,0,0,N/A,0,0,0,0,0,2,0,0,0,0,0,N/A,0,0,0,0,0,N/A,0,0,0,0,0,N/A,0,0,0,0,0,N/A,0,0,0,,0,0,N/A,0,0,0,0,0,N/A,0,0,0,0,0,N/A,0,0,0,0,0,N/A,0,0,0,0,0,N/A,0,0,0,0,0,N/A,0,0,0,,0,0,N/A,0,0,0,0,0,N/A,0,0,0,0,0,N/A,0,0,0,0,0,N/A,0,0,0,0,0,N/A,0,0,0,0,0,N/A,0,0,0,0,0,N/A,0,0,0,0,0,N/A,0,0,0,0,0,N/A,0,0,0,0,0,N/A,0,0,0,USA,N/A
421,Luna 2023,Communication and collaboration among DHH people in a co-located collaborative multiplayer AR environment,Consensus,10.1145/3597638.3614479,Communication and collaboration among DHH people in a co-located collaborative multiplayer AR environment,Sanzida Mojib Luna ,2023,5,N/A,"Totally fun first (i.e., Entertainment game reappropriated)","Game with rigid rules (i.e., video game)","Entirely skill-based (i.e., trivia, sports)","Entirely social (i.e., Tag)","Most actions can be taken at any time, but there are some phases (i.e., PvP death reset timer)","Entirely Synchronous (i.e., RTS game)","Entirely Collaborative (i.e., Pandemic)","Mostly Asymetrical (i.e., Tag)",Challenge (Testing physical or mental abilities against others or self),N/A,Interview; Controlled experiment,Semi-structured interview,Not Applicable,Not Applicable,Not Applicable,Augmented Reality,"Public space (i.e., Bowling alley); Research lab; Remote / Zoom",Deaf or hard of hearing (DHH),People with disabilities,User evaluation with stakeholders with disabilities,No,Email; Flier,Increasing understanding of users,Empirical,,17,0,0,0,0,0,,N/A,0,"0
",0,0,0,N/A,0,0,0,0,0,N/A,0,0,0,0,0,N/A,0,0,0,"0
",0,N/A,0,0,0,0,0,N/A,"
0",0,0,0,0,,N/A,0,0,0,0,0,N/A,0,0,0,0,0,N/A,0,0,0,0,0,N/A,0,0,0,0,0,N/A,0,0,0,0,0,N/A,0,0,0,0,0,,0,0,0,0,0,0,0,0,0,0,0,0,0,0,0,0,0,0,0,0,0,0,0,0,0,0,0,0,0,0,0,0,0,0,0,0,0,0,0,0,0,0,0,0,0,0,0,0,17,0,0,0,0,0,0,0,0,0,0,0,USA,N/A
420,Lu 2023,Playing with feeling: Exploring vibrotactile feedback and aesthetic experiences for developing haptic wearables for blind and low vision music learning,Consensus,10.1145/3597638.3608397,Playing with feeling: Exploring vibrotactile feedback and aesthetic experiences for developing haptic wearables for blind and low vision music learning,Leon Lu,2023,16,,"Both fun and utility first (i.e., Design workshop with diverse stakeholders)","Semi-structured play (i.e., playground game)","Entirely skill-based (i.e., trivia, sports)","Mix of solo and social affordances (i.e., Animal Crossing)","Most actions can be taken at any time, but there are some phases (i.e., PvP death reset timer)","Entirely Synchronous (i.e., RTS game)","Mix of competitive and collaborative (i.e., Mario party 2 vs 2 mini games)","Both Symetrical and Asymetrical (i.e., Pandemic—similar turn structure with different character abilities)","Construction (i.e., Music, painting, building)",,Workshop or design session,Not applicable,Bodystormming; Design probe; Prototyping,Not Applicable,Not Applicable,Wearable,School,Blind or low vision (BLV),People with disabilities,Participatory design with stakeholders with disabilities,No,"Convienience sampling (i.e., Day program)",Increasing understanding of users; Education; Increasing opportunities for enrichment ,Empirical; Artifact,,10,N/A,N/A,N/A,N/A,N/A,,9,N/A,N/A,N/A,N/A,N/A,1,N/A,N/A,N/A,N/A,N/A,N/A,N/A,N/A,N/A,N/A,N/A,N/A,N/A,N/A,N/A,N/A,N/A,N/A,N/A,N/A,N/A,N/A,N/A,N/A,N/A,N/A,N/A,N/A,N/A,,N/A,N/A,N/A,N/A,N/A,N/A,N/A,N/A,N/A,N/A,N/A,N/A,N/A,N/A,N/A,N/A,N/A,N/A,N/A,N/A,N/A,N/A,N/A,N/A,N/A,N/A,N/A,N/A,N/A,N/A,N/A,N/A,N/A,N/A,N/A,N/A,,N/A,N/A,N/A,N/A,N/A,N/A,N/A,N/A,N/A,N/A,N/A,N/A,N/A,N/A,N/A,N/A,N/A,N/A,N/A,N/A,N/A,N/A,N/A,N/A,1,N/A,N/A,N/A,N/A,N/A,"5
",N/A,N/A,N/A,N/A,N/A,2,N/A,N/A,N/A,N/A,N/A,2,N/A,N/A,N/A,N/A,N/A,N/A,N/A,N/A,N/A,N/A,N/A,N/A,N/A,N/A,N/A,N/A,N/A,Canada,
419,Duval 2023,Reimagining machine learning's role in assistive technology by co-designing exergames with children using a participatory machine learning design probe,Consensus,10.1145/3597638.3608421,Reimagining machine learning's role in assistive technology by co-designing exergames with children using a participatory machine learning design probe,Jared Duval,2023,16,,"Both fun and utility first (i.e., Design workshop with diverse stakeholders)","Semi-structured play (i.e., playground game)","Equally skill and chance based (i.e., Catan)","Mostly social, but aspects are independent (i.e., House on Hill haunt transition)","Most actions can be taken at any time, but there are some phases (i.e., PvP death reset timer)","Entirely Synchronous (i.e., RTS game)","Mix of competitive and collaborative (i.e., Mario party 2 vs 2 mini games)","Both Symetrical and Asymetrical (i.e., Pandemic—similar turn structure with different character abilities)",Challenge (Testing physical or mental abilities against others or self),,Interview; Workshop or design session; Field study,Semi-structured interview,Speculative design; Persona; Scenario; Role playing; Ideation; Bodystormming; Design probe; Prototyping; Sketching,Ethnography,Not Applicable,Mobile; Tablet,"Public space (i.e., Bowling alley); School; Research lab",Autism; Motor of physical impairment,"People with disabilities; Specialists (e.g., therapists, teachers); People without disabilities",Participatory design with stakeholders without disabilities; Participatory design with stakeholders with disabilities; User evaluation with stakeholders without disabilities; User evaluation with stakeholders with disabilities,No,"Email; Convienience sampling (i.e., Day program); Flier",Personal informatics and changing behavior; Increasing opportunities for enrichment ,Artifact,,6,2,24,N/A,N/A,N/A,,4,N/A,9,N/A,N/A,N/A,2,N/A,15,N/A,N/A,N/A,0,N/A,0,N/A,N/A,N/A,0,N/A,0,N/A,N/A,N/A,0,N/A,0,N/A,N/A,N/A,0,N/A,0,N/A,N/A,N/A,,N/A,N/A,N/A,N/A,N/A,N/A,N/A,N/A,N/A,N/A,N/A,N/A,N/A,N/A,N/A,N/A,N/A,N/A,N/A,N/A,N/A,N/A,N/A,N/A,N/A,N/A,N/A,N/A,N/A,N/A,N/A,N/A,N/A,N/A,N/A,N/A,,N/A,N/A,N/A,N/A,N/A,N/A,N/A,N/A,N/A,N/A,N/A,N/A,N/A,N/A,N/A,N/A,N/A,N/A,N/A,N/A,N/A,N/A,N/A,N/A,N/A,N/A,N/A,N/A,N/A,N/A,N/A,N/A,N/A,N/A,N/A,N/A,N/A,N/A,N/A,N/A,N/A,N/A,N/A,N/A,N/A,N/A,N/A,N/A,N/A,N/A,N/A,N/A,N/A,N/A,6,N/A,24,N/A,N/A,N/A,Sweden,USA
418,Piedade 2023,PartiPlay: A participatory game design kit for neurodiverse classrooms,Consensus,10.1145/3597638.3614496,PartiPlay: A participatory game design kit for neurodiverse classrooms,Patricia Piedade,2023,5,,"Mostly fun first (i.e., Design workshop with disabled stakeholders)","Flexible structure with rules (i.e., improv)","Mostly skill-based (i.e.,  Mario Cart)","Mix of solo and social affordances (i.e., Animal Crossing)","Follows a set of steps (i.e., Viticulture's dynamic turn ordering)","Mostly Synchronous with few asychronous affordances (i.e., League of Legends)","Entirely Collaborative (i.e., Pandemic)","Both Symetrical and Asymetrical (i.e., Pandemic—similar turn structure with different character abilities)","Construction (i.e., Music, painting, building)","Portuguese Recovery and Resilience Program, IAPMEI/ANI/FCT, Foundation for Science and Technology",Workshop or design session; Field study,Not applicable,Ideation; Prototyping; Sketching,Not Applicable,Not Applicable,Robot,School,Intellectual or developmental disability (IDD),People with disabilities,Participatory design with stakeholders with disabilities,No,"Convienience sampling (i.e., Day program)",Increasing opportunities for enrichment ,Artifact,,81,0,0,0,0,0,,N/A,0,0,0,0,0,N/A,0,0,0,0,0,N/A,0,0,0,0,0,N/A,0,0,0,0,0,N/A,0,0,0,0,0,N/A,0,0,0,0,0,,N/A,0,0,0,0,0,N/A,0,0,0,0,0,N/A,0,0,0,0,0,N/A,0,0,0,0,0,N/A,0,0,0,0,0,N/A,0,0,0,0,0,,0,0,0,0,0,0,0,0,0,0,0,0,81,0,0,0,0,0,0,0,0,0,0,0,0,0,0,0,0,0,0,0,0,0,0,0,0,0,0,0,0,0,0,0,0,0,0,0,0,0,0,0,0,0,19,0,0,0,0,0,Portugal,N/A
417,Ravers 2023,Game-based powered wheelchair skills training: Examining tensions between player engagement and therapeutic requirements,Consensus,10.1145/3597638.3614475,Game-based powered wheelchair skills training: Examining tensions between player engagement and therapeutic requirements,Douwe Ravers,2023,5,,"Mostly utility first (i.e., primary utilitarian mechanic designed first)","Flexible game (i.e., board game with house rules)","Equally skill and chance based (i.e., Catan)","Entirely Solo (i.e., Solitaire)","Most actions can be taken at any time, but there are some phases (i.e., PvP death reset timer)","Entirely Synchronous (i.e., RTS game)","Entirely Competitive (i.e., Spit card game)","Entirely Symetrical (i.e., Tik tac toe)",Challenge (Testing physical or mental abilities against others or self),,Workshop or design session,Not applicable,Ideation; Prototyping,Not Applicable,Not Applicable,Wearable; PC,Unknown,Motor of physical impairment,"Specialists (e.g., therapists, teachers)",Participatory design with stakeholders without disabilities,No,Undisclosed,Education,Artifact,,N/A,N/A,N/A,N/A,N/A,N/A,,N/A,N/A,N/A,N/A,N/A,N/A,N/A,N/A,N/A,N/A,N/A,N/A,N/A,N/A,N/A,N/A,N/A,N/A,N/A,N/A,N/A,N/A,N/A,N/A,N/A,N/A,N/A,N/A,N/A,N/A,N/A,N/A,N/A,N/A,N/A,N/A,,N/A,N/A,N/A,N/A,N/A,N/A,N/A,N/A,N/A,N/A,N/A,N/A,N/A,N/A,N/A,N/A,N/A,N/A,N/A,N/A,N/A,N/A,N/A,N/A,N/A,N/A,N/A,N/A,N/A,N/A,N/A,N/A,N/A,N/A,N/A,N/A,,N/A,N/A,N/A,N/A,N/A,N/A,N/A,N/A,N/A,N/A,N/A,N/A,N/A,N/A,N/A,N/A,N/A,N/A,N/A,N/A,N/A,N/A,N/A,N/A,N/A,N/A,N/A,N/A,N/A,N/A,N/A,N/A,N/A,N/A,N/A,N/A,N/A,N/A,N/A,N/A,N/A,N/A,N/A,N/A,N/A,N/A,N/A,N/A,N/A,N/A,N/A,N/A,N/A,N/A,N/A,N/A,N/A,N/A,N/A,N/A,Belgium,Germany
416,Poddar 2023,SignIt! An android game for sign bilingual play,Consensus,10.1145/3597638.3614484,SignIt! An android game for sign bilingual play,Roshni Poddar and Pradyumna YM,2023,4,,"Both fun and utility first (i.e., Design workshop with diverse stakeholders)","Game with rigid rules (i.e., video game)","Entirely skill-based (i.e., trivia, sports)","Mix of solo and social affordances (i.e., Animal Crossing)","Follows a set of steps (i.e., Viticulture's dynamic turn ordering)","Equal mix of synchronous and asynchronous affordances (i.e., World of Warcraft)","Entirely Competitive (i.e., Spit card game)","Entirely Symetrical (i.e., Tik tac toe)",Challenge (Testing physical or mental abilities against others or self),,Interview; Usability testing; Survey,Semi-structured interview,Not Applicable,Not Applicable,Exert analysis,Mobile,Remote / Zoom,Deaf or hard of hearing (DHH),People with disabilities,User evaluation with stakeholders with disabilities,No,"Email; Convienience sampling (i.e., Day program)",Education,Artifact,,5,0,0,0,0,0,,2,0,0,0,0,0,3,0,0,0,0,0,0,0,0,0,0,0,0,0,0,0,0,0,0,0,0,0,0,0,0,0,0,0,0,0,,N/A,0,0,0,0,0,N/A,0,0,0,0,0,N/A,0,0,0,0,0,N/A,0,0,0,0,0,N/A,0,0,0,0,0,N/A,0,0,0,0,0,,0,0,0,0,0,0,0,0,0,0,0,0,0,0,0,0,0,0,0,0,0,0,0,0,5,0,0,0,0,0,0,0,0,0,0,0,0,0,0,0,0,0,0,0,0,0,0,0,0,0,0,0,0,0,0,0,0,0,0,0,India,N/A
401,Tzanidou 2022,Co-designing the automation of theatre touch tours,Consensus,10.1145/3517428.3550370,Co-designing the automation of theatre touch tours,Alexandra Tzanidou,2022,5,,"Totally fun first (i.e., Entertainment game reappropriated)","Flexible structure with rules (i.e., improv)","Entirely skill-based (i.e., trivia, sports)","Entirely social (i.e., Tag)","Entirely Simultaneous (i.e., race)","Entirely Synchronous (i.e., RTS game)","Entirely Collaborative (i.e., Pandemic)","Both Symetrical and Asymetrical (i.e., Pandemic—similar turn structure with different character abilities)","Sensory (i.e., kaleidoscope); Fantasy (i.e., role playing)",EPSRC CDT,Interview; Workshop or design session; Field study; Focus group,Structured interview,Prototyping,Ethnography,Not Applicable,Tangible Interface,"Public space (i.e., Bowling alley)",Blind or low vision (BLV),"People with disabilities; Specialists (e.g., therapists, teachers); People without disabilities",Participatory design with stakeholders without disabilities; Participatory design with stakeholders with disabilities; User evaluation with stakeholders without disabilities; User evaluation with stakeholders with disabilities,No,"Convienience sampling (i.e., Day program)",Increasing physical access; Increasing opportunities for enrichment ,Artifact,,2,10,0,0,0,0,,N/A,N/A,0,0,0,0,N/A,N/A,0,0,0,0,N/A,N/A,0,0,0,0,N/A,N/A,0,0,0,0,N/A,N/A,0,0,0,0,N/A,N/A,0,0,0,0,,N/A,N/A,0,0,0,0,N/A,N/A,0,0,0,0,N/A,N/A,0,0,0,0,N/A,N/A,0,0,0,0,N/A,N/A,0,0,0,0,N/A,N/A,0,0,0,0,,N/A,N/A,0,0,0,0,N/A,N/A,0,0,0,0,N/A,N/A,0,0,0,0,N/A,N/A,0,0,0,0,N/A,N/A,0,0,0,0,N/A,N/A,0,0,0,0,N/A,N/A,0,0,0,0,N/A,N/A,0,0,0,0,N/A,N/A,0,0,0,0,N/A,N/A,0,0,0,0,Greece,United Kingdom
394,Barbareschi 2022,"Assistive or artistic technologies? Exploring the connections between art, disability and wheelchair use",Consensus,10.1145/3517428.3544799,"Assistive or artistic technologies? Exploring the connections between art, disability and wheelchair use",Giulia Barbareschi,2022,14,N/A,"Totally fun first (i.e., Entertainment game reappropriated)","Unstructured play (i.e., no rules, making art)","Entirely skill-based (i.e., trivia, sports)","Mix of solo and social affordances (i.e., Animal Crossing)","Most actions can be taken at any time, but there are some phases (i.e., PvP death reset timer)","Entirely Synchronous (i.e., RTS game)","Entirely Collaborative (i.e., Pandemic)","Entirely Asymetrical (i.e., Keep talking nobody explodes)","Construction (i.e., Music, painting, building)",Japan Society for Promotion of Science,Interview,Semi-structured interview,Not Applicable,Not Applicable,Not Applicable,No Technology,Not applicable,Motor of physical impairment,People with disabilities,Not applicable,No,"Convienience sampling (i.e., Day program); Word of mouth; Social Media; Other: Personal websites, Disability art organizations",Increasing understanding of users,Empirical,,17,0,0,0,0,0,,4,0,0,0,0,0,4,0,0,0,0,0,N/A,0,0,0,0,0,N/A,0,0,0,0,0,N/A,0,0,0,0,0,N/A,0,0,0,0,0,,N/A,0,0,0,0,0,N/A,0,0,0,0,0,N/A,0,0,0,0,0,N/A,0,0,0,0,0,N/A,0,0,0,0,0,N/A,0,0,0,0,0,,0,0,0,0,0,0,0,0,0,0,0,0,0,0,0,0,0,0,0,0,0,0,0,0,0,0,0,0,0,0,0,0,0,0,0,0,0,0,0,0,0,0,0,0,0,0,0,0,17,0,0,0,0,0,0,0,0,0,0,0,Japan,"United Kingdom, Canada, USA, Australia, Italy, India"
388,Ohshiro 2022,"How people who are deaf, Deaf, and hard of hearing use technology in creative sound activities",Consensus,10.1145/3517428.3550396,"How people who are deaf, Deaf, and hard of hearing use technology in creative sound activities",Keita Ohshiro,2022,4,,Not Applicable ,Not Applicable,Not Applicable,Not Applicable ,Not Applicable,Not Applicable,Not Applicable,Not Applicable,Not Applicable ,N/A,Survey,Not applicable,Not Applicable,Not Applicable,Not Applicable,No Technology,Not applicable,Deaf or hard of hearing (DHH),People with disabilities,Not applicable,No,Snowball; Social Media,Increasing understanding of users,Empirical,,50,0,0,0,0,0,,26,0,0,0,0,0,19,0,0,0,0,0,2,0,0,0,0,0,0,0,0,0,0,0,3,0,0,0,0,0,0,"0
",0,0,0,0,,N/A,0,0,0,0,0,N/A,0,0,0,0,0,N/A,0,0,0,0,0,N/A,0,0,0,0,0,N/A,0,0,0,0,0,N/A,0,0,0,0,0,,0,0,0,0,0,0,0,0,0,0,0,0,0,0,0,0,0,0,0,0,0,0,0,0,6,0,0,0,0,0,18,0,0,0,0,0,12,0,0,0,0,0,6,0,0,0,0,0,8,0,0,0,0,0,0,0,0,0,0,0,USA,N/A
386,Lu 2022,Learning music blind: Understanding the application of technology to support BLV music learning,Consensus,10.1145/3517428.3550413,Learning music blind: Understanding the application of technology to support BLV music learning,Leon Lu,2022,4,,"Both fun and utility first (i.e., Design workshop with diverse stakeholders)","Unstructured play (i.e., no rules, making art)","Entirely skill-based (i.e., trivia, sports)","Mix of solo and social affordances (i.e., Animal Crossing)","Most actions can be taken at any time, but there are some phases (i.e., PvP death reset timer)","Entirely Synchronous (i.e., RTS game)","Mostly Competitive, but sometimes collaboration is important (i.e., Forbidden Island)","Mostly Asymetrical (i.e., Tag)","Construction (i.e., Music, painting, building)",N/A,Interview,Semi-structured interview,Not Applicable,Not Applicable,Not Applicable,No Technology,Remote / Zoom,Blind or low vision (BLV),"People with disabilities; Specialists (e.g., therapists, teachers)",Not applicable,No,"Convienience sampling (i.e., Day program); Social Media",Increasing understanding of users,Empirical,,40,N/A,N/A,N/A,N/A,N/A,,N/A,N/A,N/A,N/A,N/A,N/A,N/A,N/A,N/A,N/A,N/A,N/A,N/A,N/A,N/A,N/A,N/A,N/A,N/A,N/A,N/A,N/A,N/A,N/A,N/A,N/A,N/A,N/A,N/A,N/A,N/A,N/A,N/A,N/A,N/A,N/A,,N/A,N/A,N/A,N/A,N/A,N/A,N/A,N/A,N/A,N/A,N/A,N/A,N/A,N/A,N/A,N/A,N/A,N/A,N/A,N/A,N/A,N/A,N/A,N/A,N/A,N/A,N/A,N/A,N/A,N/A,"N/A
",N/A,N/A,N/A,"N/A
",N/A,,N/A,N/A,N/A,N/A,N/A,N/A,N/A,N/A,N/A,N/A,"N/A
",N/A,N/A,N/A,N/A,N/A,N/A,N/A,N/A,N/A,N/A,N/A,N/A,N/A,N/A,N/A,"N/A
",N/A,"N/A
",N/A,N/A,N/A,N/A,N/A,N/A,N/A,N/A,N/A,N/A,N/A,N/A,N/A,N/A,N/A,N/A,N/A,"N/A
",N/A,N/A,N/A,N/A,"N/A
",N/A,N/A,N/A,N/A,N/A,N/A,N/A,N/A,Canada,"UK, US"
384,Mai 2022,SpineCurer: An inertial measurement unit based scoliosis training system,Consensus,10.1145/3517428.3550393,SpineCurer: An inertial measurement unit based scoliosis training system,Eryuan Mai,2022,4,N/A,"Totally utility first (i.e., made by clinicians, fun incorporated later)","Game with rigid rules (i.e., video game)","Entirely skill-based (i.e., trivia, sports)","Entirely Solo (i.e., Solitaire)","Most actions can be taken at any time, but there are some phases (i.e., PvP death reset timer)","Entirely Synchronous (i.e., RTS game)","Entirely Competitive (i.e., Spit card game)","Entirely Symetrical (i.e., Tik tac toe)",Challenge (Testing physical or mental abilities against others or self),"National Natural Science Foundation of China and  Science and Technology Planning
Project of Guangdong Province",Interview; Usability testing,Semi-structured interview,Not Applicable,Not Applicable,Exert analysis,Mobile; Wearable,Unknown,Motor of physical impairment,"Specialists (e.g., therapists, teachers); People without disabilities",User evaluation with stakeholders without disabilities,No,Undisclosed,Personal informatics and changing behavior,Artifact,,0,4,14,0,0,0,,0,1,10,0,0,0,0,3,4,0,0,0,0,0,0,0,0,0,0,0,0,0,0,0,0,0,0,0,0,0,0,0,0,0,0,0,,0,N/A,N/A,0,0,0,0,N/A,N/A,0,0,0,0,N/A,N/A,0,0,0,0,N/A,N/A,0,0,0,0,N/A,N/A,0,0,0,0,N/A,N/A,0,0,0,,0,N/A,N/A,0,0,0,0,N/A,N/A,0,0,0,0,N/A,N/A,0,0,0,0,N/A,N/A,0,0,0,0,N/A,N/A,0,0,0,0,N/A,N/A,0,0,0,0,N/A,N/A,0,0,0,0,N/A,N/A,0,0,0,0,N/A,N/A,0,0,0,0,N/A,N/A,0,0,0,China,N/A
